	summarized	lineages	abundances	resid	coverage
05_06_24_PLAPR29_R2__E0000000__X00__240512_NextSeq_WW__001.tsv	[('Omicron', 0.9998771189643815)]	KP.2 JN.1.11.1 KP.1 KP.1.1 KP.2.3 JN.1.18.2	0.29554231 0.29554231 0.19517550 0.19517550 0.00938338 0.00905812	4.1313635497254175	76.93876868541618
05_06_24_PLAPR28_R1__E0000000__X00__240512_NextSeq_WW__001.tsv	[('Omicron', 0.9992473602693813)]	JN.1.11.1 JN.1.4.2 JN.1.4.5 KP.2.2 JN.1.4 JN.1.8.4 JN.1.4.1	0.31659438 0.25000000 0.25000000 0.14621398 0.02090937 0.01351350 0.00201613	4.6783112190684415	76.64113968498144
05_06_24_SBAPR30_R2__E0000000__X00__240512_NextSeq_WW__001.tsv	[('Omicron', 0.9971131360241423)]	KQ.1 JN.1.4.3 JN.1.42.1 JN.1.32.1 JN.1.9.1 JN.1.32 JN.1.4.4 JN.1.4 JN.1.9.2 JN.1.18 JN.1.9 JN.1.1 JN.1.28 JN.1.20 JN.1 JN.1.40 JN.1.42 JN.1.37 JN.1.29 KR.1	0.65250651 0.15806166 0.05007360 0.03003223 0.03003223 0.03003223 0.00384922 0.00376461 0.00351659 0.00351659 0.00345350 0.00345350 0.00345350 0.00345350 0.00345350 0.00345350 0.00345350 0.00345350 0.00242131 0.00167832	3.403592640649836	64.56208407183226
05_06_24_ENCAPR29_R2__E0000000__X00__240512_NextSeq_WW__001.tsv	[('Omicron', 0.9979337798820637)]	JN.1.11 JN.1.11.1 KP.2 JN.1.16.1 JN.1.16	0.44121600 0.21770030 0.21770030 0.06065859 0.06065859	5.113201648397078	85.74390529378323
05_06_24_PLMAY01_R2__E0000000__X00__240512_NextSeq_WW__001.tsv	[('Omicron', 0.9999585185835621)]	JN.1.4.2 JN.1.4.5 KP.2 JN.1.11.1 KP.2.3	0.38526238 0.38526162 0.08796476 0.08796476 0.05350500	7.363872652740074	90.93401999799352
05_06_24_PLAPR30_R1__E0000000__X00__240512_NextSeq_WW__001.tsv	[('Omicron', 0.9998505132546368)]	JN.1.4.4 KP.2 KP.2.3 KR.1	0.46769800 0.43143812 0.05561330 0.04510110	5.6741251808327045	89.19840818646958
05_06_24_ENCMAY01_R1__E0000000__X00__240512_NextSeq_WW__001.tsv	[('Omicron', 0.9999999999991325)]	JN.1.4.4 JN.1.4.5 JN.1.4.2 JN.1.4	0.25000000 0.25000000 0.25000000 0.25000000	2.9326828180303686	57.10798247667458
05_06_24_SBMAY02_R1__E0000000__X00__240512_NextSeq_WW__001.tsv	[('Omicron', 0.9993814382434163)]	LA.2 JN.1.1.5 JN.1 JN.1.2 JN.1.3 JN.1.44 JN.1.24 JN.1.28 JN.1.21 JN.1.34 JN.1.1 JN.1.43 JN.1.9 JN.1.18 JN.1.16 JN.1.19 JN.1.24.1 JN.1.9.2 JN.1.26 JN.1.16.2 JN.1.16.1 JN.1.1.6 LB.1 JN.1.13 JN.1.14 LA.1 JN.1.1.2 JN.1.1.3 JN.4 BA.2.86.1 BA.2.86	0.03554309 0.03554309 0.03554309 0.03554309 0.03554309 0.03554309 0.03554309 0.03554309 0.03554309 0.03554309 0.03554309 0.03554309 0.03554309 0.03554309 0.03554309 0.03554309 0.03554309 0.03554309 0.03554309 0.03554309 0.03554309 0.03554309 0.03554309 0.03554309 0.03554309 0.03554309 0.03554309 0.03554309 0.00139166 0.00139166 0.00139166	3.7250378871720713	33.214058790087954
