	summarized	lineages	abundances	resid	coverage
11.3.22.PLOCT31.R2.rerun__NA__NA__221104_WW__00X.tsv	[('BA.5* [Omicron (BA.5.X)]', 0.9053963128091226), ('BA.2.75* [Omicron (BA.2.75.X)]', 0.06534696800275154), ('BA.2* [Omicron (BA.2.X)]', 0.0022693699977834134)]	BQ.1.1 BE.1.1.1 BF.7 BA.5.1.12 BN.1 BA.5.1.18 BA.5.2.1 BQ.1 BA.5.2.21 BA.5.2.31 BA.5.2.27 BF.10 BA.5.2.23 BE.1.2.1 BA.5.2.32 BA.5.2.20 BA.5.6.1 BF.14 BA.5.1.28 BF.12 BF.4 BF.3 BF.27 BA.5.1.26 BQ.1.2 BA.5.1.11 BE.1.1 BF.26 BA.5.2.28 BK.1 BA.5.1.16 BF.13 BE.2 BA.5.2.7 BF.1 BA.5.2.11 BF.5 BF.9 BA.5.2.33 BF.11 BA.5.2.5 XBB BA.5.2.29 BA.5.1.7 BA.2.82 BA.2.75.8	0.17502400 0.15513700 0.13764200 0.07809385 0.06434295 0.03634923 0.03405093 0.03061831 0.02762748 0.02452330 0.02448210 0.02274180 0.02196514 0.02185380 0.01870850 0.01244680 0.01070840 0.00991289 0.00778210 0.00547042 0.00484262 0.00479232 0.00420521 0.00299401 0.00294669 0.00291829 0.00267728 0.00241838 0.00227716 0.00197109 0.00175439 0.00171380 0.00163369 0.00151976 0.00146694 0.00144144 0.00131926 0.00127714 0.00126024 0.00125945 0.00125786 0.00124688 0.00119142 0.00111982 0.00102249 0.00100402	9.987798311662466	98.28445306490987
11.3.22.SBNOV01.R1.rerun__NA__NA__221104_WW__00X.tsv	[('BA.5* [Omicron (BA.5.X)]', 0.733951821655529), ('Omicron', 0.16409528687151292), ('BA.2.75* [Omicron (BA.2.75.X)]', 0.06516064897537509), ('BA.2* [Omicron (BA.2.X)]', 0.013090379956742058)]	BA.4.6 BA.5.1.10 BE.1.1.1 BQ.1.1 BA.5.1 BA.5 BA.5.2.9 BA.5.1.5 BA.5.2.21 BQ.1 BF.11 BA.5.5 BA.5.2.18 BA.4.8 BA.2.75.4 BA.2.75.6 BA.4.4 BA.5.2.2 BA.5.2.11 BN.1 BY.1 BF.7 BA.5.2.16 BE.1.1.2 BA.2.10.1 BA.5.1.9 BK.1 BA.2.11 BA.5.1.26 BA.5.1.12 BF.5 BA.5.2.30 BA.2.85 BA.5.2.23 BA.4.3 BA.5.1.15 BA.5.2.13 BA.5.2.10 XAA BQ.1.3 BA.5.1.25 BA.5.2.27 BM.5 BA.5.6.1 BA.4.7 BA.5.2.33 BQ.1.2 BF.16 BA.5.2.19 BA.5.2.32 BA.4.1.3 BR.3 BL.3 CD.1 BA.4.1.1 BA.2.75.8 BV.2	0.11883700 0.09997016 0.08453692 0.08333330 0.08283813 0.05833517 0.04844720 0.03452100 0.03296700 0.03218447 0.02671910 0.02340430 0.02284682 0.02121864 0.02121367 0.01623350 0.01459621 0.01458886 0.01273260 0.01123600 0.01078190 0.01000981 0.00732265 0.00655308 0.00625000 0.00505051 0.00469484 0.00372362 0.00371529 0.00364367 0.00338219 0.00330579 0.00311676 0.00300903 0.00285714 0.00266383 0.00248103 0.00240154 0.00228313 0.00225989 0.00222694 0.00207469 0.00184843 0.00173210 0.00167476 0.00157629 0.00157134 0.00154338 0.00153139 0.00150623 0.00146628 0.00137363 0.00136426 0.00121196 0.00116212 0.00110926 0.00105932	8.556191798940107	95.59575962278032
11.3.22.SBOCT28.R1.rerun__NA__NA__221104_WW__00X.tsv	[('BA.5* [Omicron (BA.5.X)]', 0.9437335778471021), ('Omicron', 0.01835483399393665), ('Other', 0.017640673999685292), ('BA.2.75* [Omicron (BA.2.75.X)]', 0.010569413006904681)]	BQ.1.1 BA.5.6 BA.5.2.16 BA.5.2.9 BA.5.1.12 BA.5.2.18 BA.5.6.1 BE.1.2 XBB.1 BF.25 BA.4.6 CB.1 BF.13 BU.1 BA.5.2.4 CC.1 BW.1 BA.5.1.9 BA.5.3.2 BA.5.6.2 BA.5.1.6 BA.4.3 BA.5.1.16 BA.5.2.28 BA.5.2.5 BA.4.4 BA.5.2.19 BA.2.75.8 BA.5.1.10 XAA BA.2.75.2 BF.10 BQ.1.2	0.26097659 0.15664563 0.13817303 0.12000000 0.06433356 0.06406878 0.04654924 0.04332130 0.01764067 0.01397597 0.01366446 0.00812965 0.00394477 0.00326797 0.00326797 0.00323625 0.00259740 0.00256410 0.00244499 0.00230456 0.00215750 0.00214133 0.00191327 0.00160514 0.00160256 0.00144404 0.00142653 0.00135044 0.00126711 0.00110500 0.00108932 0.00106895 0.00102041	11.497081714273161	96.14085543256529
11.1.22.ENCOCT27.R2.rerun__NA__NA__221104_WW__00X.tsv	[('BA.5* [Omicron (BA.5.X)]', 0.9755059317540452)]	BF.7 BF.11 BA.5.3.1 BA.5.3.2 BQ.1.2 BA.5.2.21 BA.5.2.16 BA.5.2.20 BA.5.5.2 BQ.1.1 BA.5.2.13 BA.5.2.9 BA.5.1.10 BA.5.1.26 CD.2 BA.5.6 BA.5.10.1 BF.19 BF.10 BE.1.2 BA.5.5.1 BF.16 BA.5.2.30 BE.2 BA.5.2.25 BE.3 CC.1 BF.13 BA.5.2.29	0.88082448 0.03963300 0.00673920 0.00438799 0.00406111 0.00314476 0.00278843 0.00263455 0.00219266 0.00217921 0.00201613 0.00178513 0.00175644 0.00172879 0.00165062 0.00161617 0.00156433 0.00134953 0.00133356 0.00133240 0.00132626 0.00130412 0.00126807 0.00126592 0.00122399 0.00114463 0.00114364 0.00107904 0.00103178	8.151869037351823	98.87971106577935
11.3.22.PLNOV02.R1.rerun__NA__NA__221104_WW__00X.tsv	[('BA.5* [Omicron (BA.5.X)]', 0.870976441916921), ('Omicron', 0.055624544988824465), ('BA.2.75* [Omicron (BA.2.75.X)]', 0.037627720003201894), ('BA.2* [Omicron (BA.2.X)]', 0.006802369986990176), ('Other', 0.0047922200005917105)]	BQ.1.1 BF.7 BA.5.2.21 BE.1 BA.5.2.18 XAS BA.5.1.5 BE.1.2 BN.1 BA.5.1.1 BF.10 BA.4.6 BA.5.1.12 BA.5.10 BF.14 BF.24 CA.1 BF.27 BA.5.6.1 BV.2 BF.5 BA.5.2.27 BA.5.2.9 BQ.1.3 BA.5 XBB.1 BA.5.1.24 BF.13 BA.5.1.26 BA.5.1.9 CB.1 BW.1 BA.5.2.13 BA.5.2.19 BA.5.10.1 BA.5.6.2 BF.16 BA.2.3.7 BA.5.2.24 BA.5.1.10 BF.21 BU.1 BA.2.75.8 BA.5.2.12 BE.1.3 BA.5.1.15 BA.5.2.33 BF.19 BA.5.2.28 BA.2.10.4 BA.4.1.8 XBB BA.5.1.28 BA.5.1.6 XAK BA.2.38.2 BF.25 BA.2.3.8 BF.11 BA.5.2.5 XAV BM.4	0.30607277 0.11925200 0.09884485 0.05839980 0.03705902 0.03342332 0.02526020 0.02288380 0.02221008 0.02172120 0.02042450 0.01873101 0.01702493 0.01574157 0.01293490 0.01233960 0.00994875 0.00935140 0.00919163 0.00672538 0.00656520 0.00603774 0.00577201 0.00571429 0.00547876 0.00479222 0.00356198 0.00339902 0.00320355 0.00282885 0.00278441 0.00224704 0.00224072 0.00222896 0.00218103 0.00214213 0.00196534 0.00190840 0.00189531 0.00179161 0.00174520 0.00167785 0.00166980 0.00165426 0.00163221 0.00157729 0.00154440 0.00147710 0.00141995 0.00137969 0.00127033 0.00126839 0.00126103 0.00124600 0.00117371 0.00114416 0.00113122 0.00110173 0.00108554 0.00104330 0.00102617 0.00101468	9.373868961948412	97.07721633280941
11.1.22.ENCOCT31.R2.rerun__NA__NA__221104_WW__00X.tsv	[('BA.5* [Omicron (BA.5.X)]', 0.9891924079391913)]	BE.1.1 BF.7 BA.5.1 BA.5.1.25 BA.5.2.30 BA.5.2.22 BA.5.2.13 BU.1 BQ.1.2 BE.1.1.2 BA.5.2.24 BA.5.2.29 BF.7.1 BA.5.2.9 BA.5.1.9 BA.5.3.2 BA.5.2.7 BA.5.2.18 BA.5.1.15 BA.5.1.16 BW.1 BF.10 BA.5.1.12 BA.5.6 BA.5.1.6 BF.11 BA.5.2.33 BA.5.2.20 BA.5.2.3 BE.1.2	0.32832791 0.10660003 0.10305806 0.08395320 0.08121169 0.07706850 0.06250000 0.03815563 0.03511340 0.01367990 0.01100630 0.00613497 0.00480769 0.00416320 0.00380228 0.00357995 0.00341297 0.00313725 0.00276243 0.00206683 0.00187441 0.00186916 0.00156962 0.00154732 0.00151822 0.00135777 0.00134771 0.00134138 0.00112994 0.00109469	11.920609633640266	96.84981439989299
11.3.22.PLNOV01.R1.rerun__NA__NA__221104_WW__00X.tsv	[('BA.5* [Omicron (BA.5.X)]', 0.8770557758205161), ('BA.2.75* [Omicron (BA.2.75.X)]', 0.06066794899918506), ('Omicron', 0.027986396999595646), ('BA.2* [Omicron (BA.2.X)]', 0.00967989999603048), ('Other', 0.0023752999995968337)]	BQ.1.1 BA.5.2.1 BF.7 BQ.1 BA.5.10.1 BE.1.2 BA.5.2.21 BA.5.2.27 BA.5.1.12 BM.1.1.1 BA.5 BA.5.3.2 BA.5.3.1 BA.5.1.5 BM.2 BF.3.1 BA.4.6 BF.5 BA.5.2.6 BA.5.1.25 BA.4.8 BA.2.10.4 BN.1 XAA BE.1.1.1 BF.13 BA.5.2.18 BA.2.16 BA.2.75.8 XBB.1 BW.1 BF.10 BM.5 BF.16 CC.1 BU.1 BF.17 BA.5.2.20 BA.5.2.33 BA.5.1.27 BA.2.60 XJ BA.5.1.10 BQ.1.2 BA.5.2.7 BF.11 BA.3 BA.5.2.28 BA.4.1.7 BF.14 BA.5.2.30 BE.3 BA.2.19	0.18351900 0.13182976 0.07702700 0.07224319 0.05714290 0.04168230 0.04000000 0.03707870 0.03544818 0.03500198 0.03251747 0.03049120 0.02858515 0.02503530 0.01655569 0.01517240 0.01509100 0.01354995 0.01262899 0.00815348 0.00496198 0.00483092 0.00448322 0.00430804 0.00375819 0.00309325 0.00246277 0.00244499 0.00243408 0.00237530 0.00231481 0.00229568 0.00219298 0.00202184 0.00197721 0.00173310 0.00155159 0.00148331 0.00141129 0.00140174 0.00139082 0.00139082 0.00136986 0.00134048 0.00123153 0.00120192 0.00114286 0.00110906 0.00109170 0.00108030 0.00106157 0.00105130 0.00101317	9.53888382738141	97.82296090693241
11.3.22.PLOCT30.R1.rerun__NA__NA__221104_WW__00X.tsv	[('BA.5* [Omicron (BA.5.X)]', 0.8846668059910395), ('BA.2.75* [Omicron (BA.2.75.X)]', 0.07377091600221147), ('Omicron', 0.01406278299331178), ('BA.2* [Omicron (BA.2.X)]', 0.001499809999643652), ('Delta', 0.0012570700019464648), ('A', 0.001105992027053922)]	BQ.1.1 BF.7 BA.5.2.18 BA.5.1.27 BN.1 BA.5.1 BA.5.2.21 BA.5.2.22 BQ.1 BA.5.2.16 BQ.1.2 BA.5.1.24 BA.5.1.8 BA.5.2.31 BA.5.2.6 BA.5.1.12 BA.5.2.20 BA.5.3.1 BA.2.75.6 BA.5.2.27 BF.25 BA.5.2.13 BA.5.1.26 BE.1 BA.5.1.9 BA.5.2.32 BA.4.1.8 BA.4.1.10 BF.19 BF.11 BF.16 BA.5.9 BF.12 BA.5.1.10 BA.5.1.16 BA.5.2.33 XAV BA.5.2.5 CC.1 XBB BA.5.2.2 BQ.1.4 BE.1.2 BA.5.6.2 BA.2.75.8 BA.2.75.2 BF.14 BA.5.8 XAD AY.17 XAT A.1 BA.4.1.7 BM.5 BA.5.2.7 BA.5.1.25 BA.4.6	0.13243900 0.11215000 0.08731228 0.07255520 0.05597545 0.04653265 0.04383560 0.04225350 0.03857353 0.03482390 0.03397830 0.02502580 0.02369670 0.02231044 0.02048277 0.01913197 0.01905390 0.01497563 0.01393201 0.01330600 0.01108598 0.00937207 0.00912409 0.00882812 0.00559701 0.00513809 0.00407747 0.00363636 0.00311526 0.00259179 0.00235942 0.00230415 0.00228833 0.00227101 0.00221694 0.00217369 0.00166528 0.00163399 0.00159744 0.00149981 0.00146771 0.00145773 0.00144788 0.00143589 0.00140154 0.00138432 0.00134590 0.00129702 0.00129701 0.00125707 0.00124611 0.00110599 0.00110538 0.00107759 0.00104493 0.00103520 0.00103517	9.77094041576545	98.83958131291175
