	summarized	lineages	abundances	resid	coverage
1.12.23.PLJAN08.R1__NA__NA__230112_WW__00X.tsv	[('BQ.1* [Omicron (BQ.1.X)]', 0.616317710971468), ('XBB.1.5* [Omicron (XBB.1.5.X)]', 0.11518999999674925), ('Omicron', 0.10693341895846749), ('BA.5* [Omicron (BA.5.X)]', 0.06659987166984652), ('BA.2.75* [Omicron (BA.2.75.X)]', 0.03792234888412343)]	BQ.1.1 XBB.1.5 BQ.1.1.5 XAS BQ.1.1.10 BQ.1.1.4 BQ.1.2 BW.1 XBE XBB.1.1 BQ.1.1.32 BQ.1.3 XBB.1.9 BQ.1.28 BQ.1.23 BQ.1.1.20 BQ.1.1.34 BQ.1.1.18 BQ.1.18 BQ.1.25 BQ.1.1.3 BQ.1.1.23 CR.1.1 DK.1 BQ.1.1.15 DP.1 CB.1 CW.1 XBB.2.2 BN.1.5 CH.1.1 BA.2.11 BQ.1.1.27 XBH CH.1.1.3 BN.1.8 BQ.1.1.13 BQ.1.1.29 BN.1.3.3 BQ.1.25.1 DL.1 BY.1.1 BA.5.1.9 CH.1.1.2 DS.1 CP.1.3 DC.1 BQ.1.10.1 BM.1.1.5 BA.4.1.7 BF.7.4.1 DE.2 BQ.1.1.1 CA.1 BA.4.1.3 XBB.1.4.1 CM.12 DN.1.1 BU.1 XAK BA.5.2.10 XBB.2.1 CM.8 DM.1 CY.1 BA.4.1.1 BQ.1.1.2 DJ.1.3 BA.2.8 BA.2.2.1 CZ.1 BN.1.7 CM.6.1 CM.5.1 BA.5.1.16 CM.2 BQ.1.1.21 BA.5.2.5 BQ.1.9 BQ.1.1.24 BN.1.4.1 BA.2.35 BQ.1.1.28 BE.2 XAA BQ.1.1.26 BA.2.82 BR.2.1 BA.2.75.8 BA.5.2.48	0.32158720 0.11519000 0.04386081 0.03750714 0.02944230 0.02731410 0.02218942 0.02030690 0.01882489 0.01800049 0.01787480 0.01662670 0.01517481 0.01281483 0.01237350 0.01049690 0.01047798 0.00963146 0.00876827 0.00825591 0.00785551 0.00719485 0.00696899 0.00630368 0.00565853 0.00559267 0.00522563 0.00515786 0.00469013 0.00453478 0.00413640 0.00412621 0.00366375 0.00346725 0.00343151 0.00337988 0.00311872 0.00274286 0.00246812 0.00245189 0.00238638 0.00227553 0.00226381 0.00224875 0.00208808 0.00207708 0.00198361 0.00196450 0.00195336 0.00194668 0.00183824 0.00182451 0.00179643 0.00177064 0.00174392 0.00159256 0.00154879 0.00151485 0.00151413 0.00150471 0.00142773 0.00141587 0.00141092 0.00139082 0.00138436 0.00136799 0.00132746 0.00132288 0.00131148 0.00129648 0.00129126 0.00128141 0.00125506 0.00123332 0.00122249 0.00118515 0.00116656 0.00115987 0.00114655 0.00112642 0.00109895 0.00108910 0.00108363 0.00106576 0.00106415 0.00105473 0.00101760 0.00101482 0.00101449 0.00101185	12.099393840043442	98.90312008828546
1.10.23.ENCJAN09.R2__NA__NA__230112_WW__00X.tsv	[('BQ.1* [Omicron (BQ.1.X)]', 0.6245394125848793), ('XBB.1.5* [Omicron (XBB.1.5.X)]', 0.27254738385047766), ('BA.5* [Omicron (BA.5.X)]', 0.03142016000146488), ('BA.2.75* [Omicron (BA.2.75.X)]', 0.002991199983652834), ('Omicron', 0.0012119599969385067)]	XBB.1.5 BQ.1.1.5 BQ.1.1.32 BQ.1.1 BQ.1.27 BQ.1.1.10 BQ.1.1.13 BQ.1.1.15 BA.5.1.28 BQ.1.23 BQ.1.17 BQ.1.1.18 BQ.1.1.1 BQ.1.1.2 BA.5.10 DN.1.1 BE.2 DE.1 BQ.1.1.25 BQ.1.25.1 BA.5.9 BT.2 CZ.1 BA.5.1.3 BA.5.1.15 CP.1.3 BA.5.1.30 BR.3 BM.2.1 BQ.1.1.21 BQ.1.1.24 CY.1 BA.5.2.43 BQ.1.1.26 XBG BQ.1.9 BE.8 XBE DK.1 BA.5.1.16 BQ.1.1.23 BQ.1.28 BQ.1.16 DE.2 BE.5 BA.5.2.14 BA.5.1.9	0.27254738 0.22978059 0.15194200 0.10072320 0.08455977 0.01046140 0.00654824 0.00614317 0.00493675 0.00478469 0.00428752 0.00304950 0.00263241 0.00230562 0.00210695 0.00205541 0.00192448 0.00189661 0.00189621 0.00185917 0.00183486 0.00179856 0.00177288 0.00172754 0.00168184 0.00164339 0.00163723 0.00150972 0.00148148 0.00144928 0.00137665 0.00131817 0.00131749 0.00128590 0.00121196 0.00119314 0.00115785 0.00115524 0.00115429 0.00115141 0.00110607 0.00109627 0.00107604 0.00106125 0.00102813 0.00102663 0.00101579	12.205649641468177	98.31120623348828
1.10.23.ENCJAN05.R2__NA__NA__230112_WW__00X.tsv	[('BQ.1* [Omicron (BQ.1.X)]', 0.6259423348083364), ('Omicron', 0.10626352985790057), ('XBB.1.5* [Omicron (XBB.1.5.X)]', 0.10150810738867522), ('BA.5* [Omicron (BA.5.X)]', 0.06809884294589819), ('BA.2.75* [Omicron (BA.2.75.X)]', 0.01199714999751772)]	BQ.1.1 BQ.1.27 XBB.1.5 BA.2.10 BE.1.1.1 BQ.1.16 XBB.1.9 BQ.1.1.10 BQ.1.1.7 BQ.1.15 BQ.1.2 BA.2.1 CR.1.1 BQ.1.1.31 CW.1 BA.2 BQ.1.1.8 BQ.1.12 BQ.1.1.15 BQ.1.17 BA.4.1.5 BA.5.1.15 DS.1 BN.1.3.1 BQ.1.1.13 BQ.1.1.4 BA.2.10.4 BQ.1.1.5 BQ.1.25 BA.4.1.6 BQ.1.1.2 BQ.1.13 BA.5.1.9 BA.2.16 BA.2.75.8 BQ.1.10.1 BA.5.1.11 BA.4.1.1 DF.1 BQ.1.23 BA.4.4 CN.2 CP.1.3 BN.1.3.3 BQ.1.1.6 CZ.1 BQ.1.18 BA.4.1.7 BF.7.11 BA.5.2.48 BQ.1.1.3 BF.19 BF.7.7 BA.2.10.1 BA.5.2.32 BN.6 BQ.1.1.26 DN.1.1 BF.11.1 BQ.1.28 BM.2.1 BQ.1.1.21 XBB.1.4.1 BQ.1.10 BA.5.2.30 DM.1 BE.2 BA.5.2.33 BA.2.38.2	0.23381151 0.19461416 0.10150811 0.03326645 0.03173015 0.02833480 0.02590847 0.02560450 0.02247697 0.02219690 0.02128890 0.02055538 0.01335608 0.01175194 0.01123540 0.00778498 0.00714707 0.00561741 0.00530131 0.00511866 0.00346639 0.00344531 0.00327761 0.00296189 0.00278552 0.00276052 0.00261373 0.00258742 0.00257696 0.00246485 0.00237624 0.00225873 0.00214592 0.00203562 0.00191986 0.00190331 0.00183824 0.00180699 0.00170309 0.00165837 0.00161626 0.00150150 0.00149087 0.00147620 0.00147547 0.00145722 0.00138504 0.00138404 0.00137781 0.00135320 0.00130098 0.00129310 0.00126419 0.00124881 0.00123748 0.00123724 0.00122130 0.00122087 0.00119294 0.00119284 0.00112435 0.00111888 0.00111132 0.00110270 0.00108927 0.00106045 0.00105583 0.00102386 0.00100023	11.729044235958927	98.77604253753805
1.12.23.SBJAN10.R2__NA__NA__230112_WW__00X.tsv	[('BQ.1* [Omicron (BQ.1.X)]', 0.5162784340299331), ('XBB.1.5* [Omicron (XBB.1.5.X)]', 0.22445965063917153), ('BA.2.75* [Omicron (BA.2.75.X)]', 0.0647104531531456), ('Omicron', 0.06160372001521264), ('BA.5* [Omicron (BA.5.X)]', 0.0558129378160938)]	BQ.1.1 XBB.1.5 BQ.1.1.7 BQ.1.2 BQ.1.1.5 BQ.1.10.1 BN.1.2 BQ.1.16 BN.3 XAS BN.1 BQ.1.25.1 BQ.1.1.4 CK.1 BQ.1.1.3 BA.2 XBB.1.4 BA.2.11 BA.5.1.30 DJ.1.1 BE.1.2 BQ.1.1.10 BQ.1.13 CC.1 CN.2 BQ.1.1.15 BA.5.1.28 BQ.1.1.2 BA.2.55 BW.1 BQ.1.28 BQ.1.1.1 DJ.1.3 BN.1.8 BN.1.3.1 XBB.3.1 DJ.1 BA.5.2.35 BA.2.68 BQ.1.1.29 BA.5.1.2 CR.2 CY.1 BA.4.4 BA.4.1.1 DE.1 BA.5.2.13 BN.6 CZ.1 BA.2.57 BF.31.1 BA.5.1.9 BR.3 DK.1 BQ.1.1.25 BQ.1.1.28 DN.1.1 BA.4.1.3 BM.6 BA.4.1.7 BQ.1.1.32 BQ.1.9 BQ.1.1.30 BA.4.1.4 BV.2 BA.2.70 BA.2.75.8	0.27854637 0.22445965 0.05298572 0.04041720 0.02939556 0.02611475 0.02422000 0.02088240 0.01659960 0.01586749 0.01433450 0.01366340 0.01269390 0.01249788 0.01153240 0.01079176 0.01060951 0.00840386 0.00508586 0.00400264 0.00397726 0.00391980 0.00390879 0.00310325 0.00305577 0.00291662 0.00291074 0.00269058 0.00262467 0.00246981 0.00231884 0.00231171 0.00229389 0.00220751 0.00218747 0.00213123 0.00196357 0.00192585 0.00188399 0.00184969 0.00184706 0.00180080 0.00176305 0.00169980 0.00161900 0.00161024 0.00160217 0.00155473 0.00154743 0.00154261 0.00143225 0.00143215 0.00141157 0.00135318 0.00132536 0.00132310 0.00128317 0.00124204 0.00119076 0.00112368 0.00111188 0.00109446 0.00109213 0.00105330 0.00103869 0.00101078 0.00100432	11.371671662237947	97.16416413068923
1.12.23.PLJAN10.R1__NA__NA__230112_WW__00X.tsv	[('BQ.1* [Omicron (BQ.1.X)]', 0.6671436521483267), ('BA.5* [Omicron (BA.5.X)]', 0.13225899330517724), ('XBB.1.5* [Omicron (XBB.1.5.X)]', 0.05887020000001753), ('BA.2.75* [Omicron (BA.2.75.X)]', 0.052583839909593), ('Omicron', 0.02687598897257419), ('Other', 0.0010365900013410434)]	BQ.1.1 XBB.1.5 BA.5.1.10 BQ.1.2 BR.1.2 BQ.1.1.10 BQ.1.25.1 BQ.1.27 BQ.1.1.32 BQ.1.16 BQ.1.17 BE.1.1 BQ.1.1.4 BQ.1.28 BQ.1.1.18 BQ.1.5 BQ.1.12 BK.1 BW.1 BQ.1.1.28 BQ.1.1.3 BQ.1.1.29 BQ.1.1.7 BQ.1.1.5 CR.1.1 BQ.1.13 BQ.1.3 BQ.1.18 BQ.1.1.22 BE.1.2.1 BM.1.1.4 XBB.1.1 XBB.2.2 BQ.1.1.2 BA.5.2.35 CM.5.1 BE.7 BQ.1.14 BQ.1.1.15 BT.2 DJ.1.1 BQ.1.1.24 BM.4 BN.1.3.1 BQ.1.1.17 XBB.1.9 BU.1 CP.1.1 CM.8 XBG CZ.1 BE.1.1.2 CN.2 BE.2 DE.2 BA.5.1.9 BQ.1.1.13 BA.5.5.2 BR.2.1 BQ.1.1.21 BQ.1.1.8 CC.1 XBB.1.4 DN.1.1 CY.1 BM.6 DK.1 BQ.1.9 CQ.1 BA.5.1.31 CH.1.1.3 CM.12 BF.7.4.1 XBB.1.4.1 BQ.1.1.26 BE.1.4.1 BA.5.5.1 BF.11.2 BQ.1.1.30 XBB.2.1 BE.1.4.2 BA.2.75.8 BM.2.1 DG.1 BA.5.2.43 XBB.1.7 XAZ CV.1 BQ.1.23 BQ.1.8.2 BQ.1.1.23 DJ.1.3 BM.2.3 XBC.1.1 BQ.1.1.20 BA.5.2.48	0.33465620 0.05887020 0.04228557 0.03561710 0.03265392 0.03204970 0.02785880 0.02692038 0.02657290 0.01943360 0.01552006 0.01402355 0.01347710 0.01325910 0.01013950 0.00982942 0.00914700 0.00813858 0.00799526 0.00780959 0.00749438 0.00728035 0.00689390 0.00687673 0.00674148 0.00526442 0.00525994 0.00494148 0.00494100 0.00482816 0.00440906 0.00401383 0.00400264 0.00386045 0.00376593 0.00346998 0.00341441 0.00331126 0.00328475 0.00326531 0.00318854 0.00309500 0.00308275 0.00303689 0.00287522 0.00270589 0.00250091 0.00243971 0.00237804 0.00236365 0.00231110 0.00222852 0.00219587 0.00210250 0.00207094 0.00197200 0.00196619 0.00183688 0.00180305 0.00179533 0.00179436 0.00178042 0.00167539 0.00162730 0.00159830 0.00159188 0.00155634 0.00153812 0.00152510 0.00149023 0.00148478 0.00145072 0.00137268 0.00136044 0.00134761 0.00134068 0.00132526 0.00128700 0.00122729 0.00120826 0.00119457 0.00119432 0.00115130 0.00114903 0.00112926 0.00112608 0.00112108 0.00111263 0.00111111 0.00110566 0.00107286 0.00107168 0.00106326 0.00103659 0.00102105 0.00100067	10.54039555105275	98.63893254857372
1.10.23.ENCJAN06.R1__NA__NA__230112_WW__00X.tsv	[('BA.2.75* [Omicron (BA.2.75.X)]', 0.6399460350689111), ('BQ.1* [Omicron (BQ.1.X)]', 0.18863376873169801), ('BA.5* [Omicron (BA.5.X)]', 0.04563163992177062), ('XBB.1.5* [Omicron (XBB.1.5.X)]', 0.04495133672754938), ('Omicron', 0.02454598550015799)]	CA.5 XBB.1.5 BE.1.1.1 BA.2.75.7 BQ.1.16 BQ.1.2 BQ.1.1.29 BQ.1.1.3 BQ.1.1.24 BQ.1.18 BQ.1.23 BQ.1.8 XBF XBB.1.9 BQ.1.10 BQ.1.1.10 BQ.1.8.2 BQ.1.12 BQ.1.1.7 BQ.1.1.20 XBB.2.2 CC.1 BQ.1.1.15 XBB.3.1 BY.1.1 DS.1 BQ.1.25 BQ.1.1.32 BT.2 BQ.1.1.1 BQ.1.1.2 BQ.1.17 BQ.1.28 BA.2.10.4 BQ.1.1.28 BW.1.1 CA.6 CZ.1 BQ.1.25.1 BQ.1.9 CN.2 XBB.1.4.1 BQ.1.1.4 CP.1.3 BQ.1.5 BA.2.75.8 DH.1 DM.1 DP.1 BQ.1.7 XBB.2.1 BA.2.2.1 BA.2.75.10 BF.13 BA.5.2.43 XBB.1.7	0.60306100 0.04495134 0.03219479 0.02782677 0.02336560 0.01920100 0.01815515 0.01775410 0.01592100 0.01495470 0.01125700 0.01112738 0.00598895 0.00561331 0.00560522 0.00499376 0.00452622 0.00439024 0.00424644 0.00399143 0.00379429 0.00338684 0.00318907 0.00267986 0.00259796 0.00233313 0.00231204 0.00226454 0.00224215 0.00222629 0.00216946 0.00211665 0.00211472 0.00183610 0.00180076 0.00178781 0.00178671 0.00165532 0.00162334 0.00153754 0.00149762 0.00139182 0.00139147 0.00131648 0.00128731 0.00125587 0.00117825 0.00116324 0.00116300 0.00112978 0.00112643 0.00111387 0.00108460 0.00102505 0.00100265 0.00100135	12.100891149572007	98.76935424539344
1.12.23.PLJAN11.R1__NA__NA__230112_WW__00X.tsv	[('BQ.1* [Omicron (BQ.1.X)]', 0.5217827963732807), ('XBB.1.5* [Omicron (XBB.1.5.X)]', 0.27265393221356726), ('BA.5* [Omicron (BA.5.X)]', 0.07853389587329243), ('BA.2.75* [Omicron (BA.2.75.X)]', 0.04600446169095798), ('Omicron', 0.015467068741243274)]	XBB.1.5 BQ.1.1 BQ.1.2 BQ.1.1.10 BQ.1.25.1 BQ.1.28 BQ.1.1.32 BQ.1.27 BQ.1.1.3 BQ.1.1.4 BQ.1.1.1 BW.1 BA.5.6.2 CH.1.1 XBE BQ.1.1.5 CH.1.1.2 BE.1.1 BQ.1.1.2 XBB.1.9.1 BQ.1.1.7 BQ.1.8.2 BQ.1.3 BM.4 BF.7.14 BQ.1.8 BE.1.2.1 BQ.1.1.15 BQ.1.1.34 DP.1 BQ.1.22 BQ.1.23 CC.1 BV.2 BQ.1.1.13 BY.1.1 BE.1.1.2 BR.3 CN.2 BQ.1.9 BN.3 BQ.1.1.21 BN.1.3.3 XAV BN.1.2 BA.2.75.8 BF.7.11 DG.1 BN.1.3.1 CV.1 BQ.1.1.29 XBB.1.4.1 BJ.1 BM.2.1 DK.1 BQ.1.1.24 CP.1.1 BN.1.3 BQ.1.16 CY.1 BA.5.2.13 CZ.1 BQ.1.1.23 BQ.1.5 DJ.1.3 DN.1.1 CR.1.3 CM.12 BQ.1.1.18 BQ.1.18 BA.5.2.43 BQ.1.1.28 CQ.1 BQ.1.21 BA.4.1.7 BF.31.1 BQ.1.1.25 DH.1 BQ.1.1.26 XBB.1.7 BM.2.3	0.27265393 0.16827888 0.05792550 0.05285500 0.03877640 0.03107040 0.02474050 0.02031312 0.01703960 0.01438850 0.01316618 0.01249493 0.01160401 0.01007262 0.00913674 0.00876998 0.00846024 0.00795001 0.00653595 0.00645584 0.00584062 0.00581793 0.00567585 0.00547013 0.00480604 0.00480567 0.00473657 0.00417771 0.00397344 0.00367240 0.00360130 0.00335570 0.00329257 0.00298807 0.00291636 0.00272961 0.00268268 0.00264325 0.00260109 0.00243685 0.00238483 0.00226025 0.00223931 0.00214509 0.00210704 0.00205748 0.00204739 0.00203169 0.00184923 0.00181901 0.00177813 0.00176857 0.00160256 0.00159840 0.00159544 0.00157584 0.00157491 0.00156073 0.00154932 0.00154730 0.00154395 0.00147212 0.00146222 0.00144801 0.00141683 0.00141051 0.00136382 0.00130731 0.00126967 0.00126462 0.00125809 0.00125472 0.00125026 0.00116899 0.00116192 0.00116038 0.00109544 0.00104657 0.00104367 0.00102578 0.00101259	11.69326394716979	97.21767046784603
1.12.23.PLJAN09.R1__NA__NA__230112_WW__00X.tsv	[('BQ.1* [Omicron (BQ.1.X)]', 0.639974223712524), ('XBB.1.5* [Omicron (XBB.1.5.X)]', 0.16503699999945312), ('BA.5* [Omicron (BA.5.X)]', 0.06293295842867998), ('BA.2.75* [Omicron (BA.2.75.X)]', 0.041569496932943054), ('Omicron', 0.01603075700042423)]	BQ.1.1 XBB.1.5 BQ.1.1.4 BQ.1.2 BQ.1.27 BQ.1.1.10 BQ.1.1.32 BQ.1.28 BQ.1.1.13 BQ.1.1.23 BQ.1.12 BQ.1.10 BQ.1.1.34 BQ.1.7 BQ.1.8 BQ.1.1.29 BQ.1.5 BW.1 BR.3 BR.1 BQ.1.16 XBE BQ.1.14 BQ.1.13 DF.1 CM.8 BQ.1.3 BV.2 BQ.1.1.15 BQ.1.25.1 BQ.1.23 DN.1.1 BU.1 BQ.1.1.27 BF.7.14 CC.1 CZ.1 BM.2.1 CM.4 BQ.1.1.2 BN.1.3.3 BN.3 BN.6 BQ.1.1.21 BF.7.5 BA.5.1.15 DJ.1.2 XAT BQ.1.18 BF.7.13.2 BN.1.4 BQ.1.17 CP.1.3 DJ.1.3 BF.16 BY.1.1 DS.1 BQ.1.9 DH.1 BE.2 BA.5.1.9 CV.1 BQ.1.1.28 BF.7.4.1 XBB.1.4.1 BA.5.1.16 BM.6 BA.5.2.48 CM.12 XBB.1.9 BA.2.79.1 DE.2 BF.7.5.1 DK.1 BN.1.4.1 BU.3 CH.1.1.2 BN.1.7 BR.2.1 BN.1.3 DR.1	0.18103817 0.16503700 0.06506020 0.05531110 0.05447158 0.04567980 0.03189360 0.03009920 0.01544806 0.01541440 0.01481110 0.01248226 0.01221854 0.01102940 0.01092599 0.01010962 0.00984266 0.00917101 0.00883025 0.00764969 0.00688323 0.00677783 0.00657895 0.00637692 0.00562272 0.00559441 0.00548264 0.00500043 0.00495540 0.00450275 0.00447094 0.00369727 0.00339703 0.00330442 0.00326087 0.00323428 0.00316518 0.00310078 0.00300210 0.00291892 0.00278405 0.00268219 0.00267738 0.00262985 0.00237314 0.00223839 0.00203545 0.00201568 0.00193237 0.00192205 0.00190538 0.00189087 0.00186498 0.00177248 0.00175827 0.00175088 0.00162767 0.00159505 0.00156912 0.00154639 0.00153509 0.00151515 0.00150130 0.00147330 0.00142239 0.00140173 0.00138574 0.00136488 0.00134738 0.00133270 0.00131609 0.00126103 0.00120551 0.00119330 0.00118071 0.00114698 0.00114211 0.00112962 0.00112113 0.00108676 0.00105920	12.079577617379762	97.80958432264322
