	summarized	lineages	abundances	resid	coverage
1.04.23.ENCDEC30.R1__NA__NA__230107_WW__00X.tsv	[('BQ.1* [Omicron (BQ.1.X)]', 0.677392534944255), ('Omicron', 0.11668541009927683), ('BA.2.75* [Omicron (BA.2.75.X)]', 0.07482238538809001), ('BA.5* [Omicron (BA.5.X)]', 0.05668848896372158)]	BQ.1.1 XBB.1.5 BN.1.5 BQ.1.1.18 BQ.1.2 BQ.1.1.2 BQ.1.1.29 BQ.1.1.32 BQ.1.1.7 BQ.1.18 BQ.1.28 BQ.1.27 BQ.1.1.13 BQ.1.3 BQ.1.8 BQ.1.16 DP.1 BQ.1.1.5 CA.3.1 BQ.1.12 BA.4.6.3 CR.1.1 CP.1.3 BQ.1.1.23 BQ.1.14 BQ.1.1.25 BA.5.5.1 BQ.1.17 XBH BQ.1.1.4 BL.1.3 BA.5.2.14 BQ.1.5 BQ.1.1.1 BQ.1.1.10 BA.4.6.2 BQ.1.1.15 CC.1 BA.2.11 BA.2.75.8 CA.5 BN.1.3.1 CR.2 BN.1.7 XAJ BA.4.1.3 BQ.1.13 CR.1.3 BA.5.5.2 BQ.1.15 DC.1 CP.3 BA.2.10.4 CN.2 DG.1 BA.2.8 BA.2.82 BF.7.14 BF.19 BA.5.2.9 BF.11 BA.4.3 BA.5.2.40 BR.3 XBB.1.4.1 BQ.1.25.1 BA.5.2.10 BF.7.4.2 BE.1.4.2 BY.1.1 BT.2 XBB.1.4 XY BN.1.8 XBB.1.7 BQ.1.1.26 XBE BN.1.2 BQ.1.1.24 CZ.1 BV.1 XE BA.5.2.48 BQ.1.1.21 BQ.1.8.2 BA.2.44 BQ.1.1.6 CH.1.1.2 BW.1.1 BE.2 DK.1 XBB.3.3 BQ.1.21 BA.2.9.1 DN.1.1	0.25714115 0.07526722 0.04116977 0.03799770 0.03280450 0.03252030 0.02891872 0.02758110 0.02439125 0.02215300 0.02146951 0.02107437 0.02099126 0.01967070 0.01770335 0.01638731 0.01525630 0.01400514 0.01372034 0.01178730 0.00822032 0.00695903 0.00691244 0.00629478 0.00520021 0.00512181 0.00499375 0.00499002 0.00479713 0.00457038 0.00455712 0.00454664 0.00391949 0.00369701 0.00340830 0.00323352 0.00309997 0.00279720 0.00275131 0.00251414 0.00232509 0.00221473 0.00220816 0.00220778 0.00220035 0.00214535 0.00211416 0.00208796 0.00194742 0.00193648 0.00192422 0.00190190 0.00182191 0.00181951 0.00181724 0.00179557 0.00171532 0.00167785 0.00165000 0.00164516 0.00151401 0.00143335 0.00138909 0.00137133 0.00136150 0.00135200 0.00134048 0.00132183 0.00131536 0.00129397 0.00128617 0.00128371 0.00125523 0.00122015 0.00119454 0.00117796 0.00117385 0.00116414 0.00116322 0.00115972 0.00114811 0.00114764 0.00112969 0.00109218 0.00109075 0.00107141 0.00107021 0.00106383 0.00106150 0.00104414 0.00104185 0.00103489 0.00103183 0.00103093 0.00100726	11.94062236272234	99.16730762799719
1.05.23.SBJAN03.R2__NA__NA__230107_WW__00X.tsv	[('BQ.1* [Omicron (BQ.1.X)]', 0.9470563119421139), ('Omicron', 0.009382673976758243), ('BA.5* [Omicron (BA.5.X)]', 0.007774073971312962), ('BA.2.75* [Omicron (BA.2.75.X)]', 0.00111899999929705)]	BQ.1.1.4 BQ.1.1.32 BQ.1.1.10 BQ.1.1.18 XBB.1.5 BQ.1.17 BQ.1.1.7 BQ.1.1.21 BQ.1.1.15 BQ.1.22 BW.1.1 BQ.1.25.1 BQ.1.3 BQ.1.10.1 CQ.1 BQ.1.1.29 CZ.1 BU.1 BQ.1.9 BQ.1.1.1 XBB.3.3 XBB.1.3 DR.1 BQ.1.28 BQ.1.16 BQ.1.25 BA.2.75.8 CR.1.1 XBB.1.4.1 DK.1	0.88327500 0.01215490 0.00910587 0.00727260 0.00523885 0.00379747 0.00296826 0.00281690 0.00278850 0.00273522 0.00266188 0.00257943 0.00222274 0.00215569 0.00212179 0.00191320 0.00190855 0.00188223 0.00175172 0.00174109 0.00160462 0.00152003 0.00139082 0.00120362 0.00113993 0.00113213 0.00111900 0.00110817 0.00101918 0.00100267	8.67120299033668	97.37150118717186
1.05.23.PLJAN04.R1__NA__NA__230107_WW__00X.tsv	[('BQ.1* [Omicron (BQ.1.X)]', 0.6711557035609401), ('Omicron', 0.15899573526821087), ('BA.5* [Omicron (BA.5.X)]', 0.07408190678898324), ('BA.2.75* [Omicron (BA.2.75.X)]', 0.03535838789849752)]	BQ.1.1 BQ.1.2 XBB.1.5 BQ.1.1.32 BQ.1.1.4 BQ.1.1.10 BQ.1.28 BQ.1.18 BQ.1.10.1 BQ.1.1.2 XAS BQ.1.1.18 BQ.1.1.28 BQ.1.25.1 BR.2 CB.1 BQ.1.22 BE.1.4.1 BQ.1.1.15 BQ.1.1.5 XBB.1.6 BQ.1.25 BW.1 BQ.1.1.27 BQ.1.1.3 BU.1 BW.1.1 BA.5.2.48 BQ.1.6 CR.1.1 BQ.1.1.13 BQ.1.1.8 BQ.1.4 BQ.1.1.20 BQ.1.1.21 BF.16 BQ.1.3 BF.7.4.1 BN.1.3.1 BF.13 CQ.1 BA.5.6.2 BN.1.4 BE.1.1.2 DN.1.1 BR.2.1 CC.1 CY.1 DC.1 BF.19 BA.5.2.5 CP.1.3 DG.1 DE.2 BQ.1.1.25 CM.8 BN.1.7 BQ.1.9 BQ.1.8 BR.3 BF.15 BE.2 BN.1.3.3 BN.3 CM.5.1 CZ.1 XBB.2.2 BA.2.75.8 CW.1 BA.5.1.9 BF.14 BY.1.1 XBG BQ.1.1.23 BA.5.2.43 BF.7.3 XBB.2.1 BA.4.6.3 BE.1.2.1 BF.3.1 BQ.1.1.24 BQ.1.1.29 BF.10 BU.3 BG.2 DL.1 BM.6 BQ.1.1.26 BA.5.1.16 BA.2.79.1 BE.5 BF.7.13.1 BQ.1.8.2 CV.1	0.24761993 0.17827700 0.13100424 0.04238750 0.04024140 0.02109550 0.01337330 0.01142130 0.01028810 0.00991003 0.00940192 0.00925926 0.00840654 0.00827667 0.00798853 0.00777502 0.00727392 0.00616509 0.00600907 0.00537573 0.00511869 0.00502083 0.00455976 0.00438596 0.00422059 0.00403633 0.00377715 0.00355408 0.00333131 0.00331903 0.00318197 0.00315871 0.00301811 0.00293059 0.00284553 0.00283036 0.00282586 0.00273723 0.00268456 0.00265557 0.00255723 0.00251539 0.00239808 0.00237870 0.00235420 0.00230407 0.00229621 0.00228162 0.00223947 0.00216325 0.00215750 0.00209426 0.00193050 0.00191266 0.00189777 0.00189316 0.00187735 0.00186628 0.00181811 0.00178070 0.00176211 0.00172863 0.00171787 0.00167537 0.00165466 0.00162844 0.00161005 0.00160033 0.00158688 0.00153965 0.00142332 0.00140830 0.00134559 0.00132494 0.00131536 0.00126183 0.00123903 0.00123102 0.00121269 0.00119854 0.00119310 0.00117847 0.00117513 0.00117371 0.00116780 0.00115090 0.00114504 0.00114384 0.00112334 0.00109012 0.00106295 0.00103183 0.00102897 0.00100317	10.460607155203439	97.31130655787045
1.05.23.PLJAN02.R1__NA__NA__230107_WW__00X.tsv	[('BQ.1* [Omicron (BQ.1.X)]', 0.6428632766541517), ('Omicron', 0.14756900496541164), ('BA.5* [Omicron (BA.5.X)]', 0.1025954907588924), ('BA.2.75* [Omicron (BA.2.75.X)]', 0.038452205935999205)]	BQ.1.1 XBB.1.5 BQ.1.27 BQ.1.1.4 BQ.1.28 BQ.1.1.18 BQ.1.1.28 BQ.1.1.32 BQ.1.2 BQ.1.25.1 BQ.1.17 BQ.1.12 BQ.1.1.1 XAS BQ.1.16 BQ.1.1.24 BQ.1.15 BQ.1.1.5 BQ.1.14 CB.1 XBB.1.6 BQ.1.1.7 BQ.1.18 BQ.1.1.3 BW.1.1 XBE BN.1.3.1 BQ.1.10 BQ.1.1.13 CW.1 BQ.1.6 BK.1 BA.5.11 CL.1 BQ.1.23 CR.1.1 BQ.1.22 BQ.1.1.29 CA.3.1 BQ.1.1.15 BQ.1.3 BF.7.5 BF.24 BQ.1.1.10 BR.2.1 BF.7.1 DR.1 CM.4 BF.7.3 BQ.1.1.2 CZ.1 BA.4.1.1 CQ.1 BR.3 BE.2 XY DJ.1.2 BM.6 BU.1 CM.3 BF.7.11 BF.11.5 BF.7.4.2 BA.5.2.48 BN.3 XBB.1.7 BF.16 BQ.1.9 DE.2 BQ.1.8 DF.1 DC.1 CM.8 BQ.1.1.25 BN.1.7 BE.10 BQ.1.1.26 CP.1.1 XBB.1.4.1 BE.8 CN.2 BF.7.5.1 XV BA.2.68 BY.1.1 BA.2.3.14 BF.11.1 BE.4.2 BA.2.10.4 CY.1 CN.1 BA.5.1.9 CM.1 BA.4.1.3 BQ.1.13 XE BF.11.2 DJ.1.3 BF.7.4.1 BF.7.7 XBG BA.4.1.7 BA.2.43 BA.2.2.1 BA.5.2.43 BA.2.3.7 BA.2.8 BA.2.75.8 BA.2.70 BA.1.15.1 BA.2.25.1 BF.15	0.09552957 0.08518170 0.08087895 0.05305650 0.05025820 0.04441710 0.03118250 0.02849960 0.02581850 0.02221560 0.01736945 0.01632862 0.01444583 0.01400868 0.01335260 0.01220660 0.01153597 0.01097927 0.01082790 0.01073830 0.00976749 0.00957957 0.00907258 0.00885982 0.00869565 0.00822292 0.00819730 0.00817836 0.00809954 0.00796182 0.00747791 0.00714436 0.00603415 0.00601113 0.00571429 0.00514096 0.00512522 0.00484985 0.00477040 0.00437956 0.00400278 0.00387551 0.00354800 0.00340933 0.00324170 0.00316525 0.00293378 0.00288012 0.00284206 0.00278404 0.00264817 0.00261680 0.00247878 0.00247191 0.00241783 0.00240832 0.00237260 0.00235955 0.00235842 0.00235362 0.00231228 0.00231011 0.00226028 0.00225214 0.00224682 0.00211305 0.00202683 0.00196873 0.00196086 0.00194249 0.00192652 0.00192084 0.00187869 0.00183418 0.00180142 0.00176314 0.00175044 0.00174825 0.00168687 0.00165906 0.00162300 0.00162016 0.00160141 0.00154377 0.00152009 0.00151884 0.00151196 0.00150050 0.00149142 0.00148810 0.00146799 0.00146474 0.00140581 0.00139716 0.00138805 0.00135962 0.00131640 0.00131366 0.00129844 0.00126978 0.00124494 0.00124470 0.00123232 0.00123036 0.00115741 0.00112423 0.00111498 0.00110472 0.00108661 0.00108643 0.00107022 0.00103627	11.56737008120978	98.4917901213925
1.05.23.PLJAN03.R1__NA__NA__230107_WW__00X.tsv	[('BQ.1* [Omicron (BQ.1.X)]', 0.7605004587322449), ('Omicron', 0.09842080899093296), ('BA.5* [Omicron (BA.5.X)]', 0.041978277540252455), ('BA.2.75* [Omicron (BA.2.75.X)]', 0.027517207489904532)]	BQ.1.1.5 BQ.1.1 XBB.1.5 BQ.1.27 BQ.1.15 BQ.1.1.4 BQ.1.1.32 BQ.1.2 BQ.1.1.10 BQ.1.1.2 BQ.1.1.18 BN.1.3.1 BQ.1.28 BE.1.2 BQ.1.25.1 BQ.1.1.3 CB.1 BQ.1.1.29 BQ.1.14 BQ.1.1.15 BQ.1.16 BQ.1.1.17 BQ.1.3 DF.1 BQ.1.12 BQ.1.10 BQ.1.1.28 BQ.1.10.1 BQ.1.1.7 XBE BA.5.2.43 BN.1.4 BQ.1.17 BE.1.2.1 BQ.1.18 BE.1.1.2 BA.2.75.8 BN.1.2 CQ.1 BM.6 BA.4.3 BQ.1.5 BA.4.1.1 BA.5.2.41 BN.1.7 BN.1.3.3 BE.2 BF.11.2 BA.4.1.3 XBB.1.4.1 BA.5.2.5 XBB.1.4 CZ.1 BA.5.1.31 XY DE.2 BQ.1.1.23 BQ.1.1.20 BE.5 BU.1 BA.2.2.1 BQ.1.1.1 BQ.1.1.26 BY.1.1 CP.1.1 CR.1.1 BW.1.1 BQ.1.8.2 BQ.1.21 DJ.1.3 BA.2.77 BA.2.38.2 XBB.3.3 BA.2.3.7	0.26118728 0.22525235 0.08211850 0.03641150 0.03448467 0.02955970 0.02873560 0.02417620 0.02038210 0.01025980 0.00777215 0.00740149 0.00734628 0.00714479 0.00673684 0.00607791 0.00564313 0.00508346 0.00471945 0.00471910 0.00437668 0.00434329 0.00410202 0.00404040 0.00394547 0.00379080 0.00373832 0.00342123 0.00332031 0.00297971 0.00274725 0.00266914 0.00260100 0.00259025 0.00238450 0.00228112 0.00225867 0.00220407 0.00215435 0.00214391 0.00212766 0.00205990 0.00202478 0.00202079 0.00199786 0.00193551 0.00188479 0.00187817 0.00183055 0.00171328 0.00166389 0.00165112 0.00164624 0.00152478 0.00150482 0.00149719 0.00148388 0.00144703 0.00143416 0.00136044 0.00133422 0.00132553 0.00131682 0.00126342 0.00125865 0.00123839 0.00120658 0.00117370 0.00111935 0.00107258 0.00103788 0.00103230 0.00103150 0.00101420	12.046094080131288	98.83623716683945
1.05.23.SBDEC30.R1__NA__NA__230107_WW__00X.tsv	[('BQ.1* [Omicron (BQ.1.X)]', 0.5855789540916255), ('BA.2.75* [Omicron (BA.2.75.X)]', 0.16568173125584443), ('BA.5* [Omicron (BA.5.X)]', 0.13989604591961646), ('Omicron', 0.05116333976624162), ('A', 0.0011089999985148253)]	BQ.1.1 BQ.1.1.32 BN.1.3 BQ.1.2 XBB.1.5 BQ.1.28 BE.1 CB.1 BW.1.1 BE.1.1.1 BQ.1.1.1 BQ.1.10.1 BQ.1.18 BQ.1.3 BQ.1.23 BQ.1.1.30 BQ.1.1.10 BQ.1.16 CR.1.1 BQ.1.1.5 BQ.1.1.13 BN.1.3.4 BQ.1.1.7 BQ.1.17 BQ.1.12 BE.1.4.1 CR.2 BQ.1.15 BQ.1.1.15 BQ.1.1.21 BN.1.7 BF.5 BQ.1.1.18 BQ.1.22 BQ.1.25 BQ.1.1.4 BQ.1.1.24 BN.1.4 BQ.1.1.29 BQ.1.1.2 DE.1 BE.1.4.2 BN.1.3.1 BQ.1.25.1 BQ.1.1.25 BM.6 CZ.1 XBG BQ.1.1.27 BM.2.1 BF.19 BA.2.38.2 DM.1 BA.2.75.8 BV.2 XBB.1.7 BF.3.1 BA.5.2.48 CK.1 BF.16 BU.1 BE.2 BF.5.2 BQ.1.1.3 BQ.1.1.22 BQ.1.1.20 BE.8 XAC CK.2.1 BF.11.2 A.28 DJ.1.2 CH.1.1.2 CV.1 BQ.1.1.9 CY.1 DJ.1.3 BQ.1.9 BR.3 BN.6	0.14131875 0.14043700 0.11125032 0.06027660 0.04517907 0.04280160 0.03944325 0.03216370 0.03041490 0.02464230 0.02354625 0.01862030 0.01659500 0.01639070 0.01528419 0.01428210 0.01307310 0.01205770 0.01106877 0.00919180 0.00545511 0.00541123 0.00455833 0.00433142 0.00431496 0.00412225 0.00405759 0.00382614 0.00372777 0.00347866 0.00326797 0.00279477 0.00269744 0.00266524 0.00263772 0.00260417 0.00233285 0.00228249 0.00218281 0.00211416 0.00205683 0.00202288 0.00196648 0.00196259 0.00194536 0.00185690 0.00181355 0.00176574 0.00167112 0.00166548 0.00166251 0.00162521 0.00159872 0.00159744 0.00154873 0.00147260 0.00143225 0.00142709 0.00138852 0.00137367 0.00133666 0.00125946 0.00123753 0.00122996 0.00122971 0.00122354 0.00118203 0.00112072 0.00111556 0.00111323 0.00110900 0.00108637 0.00108493 0.00108225 0.00106901 0.00106222 0.00104668 0.00103353 0.00102796 0.00102459	11.504358269722719	97.62900043473898
1.05.23.PLJAN01.R1__NA__NA__230107_WW__00X.tsv	[('BQ.1* [Omicron (BQ.1.X)]', 0.5776679379847178), ('BA.5* [Omicron (BA.5.X)]', 0.1523231684958739), ('Omicron', 0.14114833339483696), ('BA.2.75* [Omicron (BA.2.75.X)]', 0.060202889099377536)]	BQ.1.1 XBB.1.5 BE.1.2 BQ.1.1.10 BQ.1.1.3 BQ.1.10.1 XAS BQ.1.12 BQ.1.2 BQ.1.1.5 BN.1.3 BQ.1.28 BA.5.11 BA.5.1.7 BQ.1.1.4 BQ.1.17 CR.2 BQ.1.1.1 CR.1.1 BQ.1.1.32 BV.2 BQ.1.1.18 BQ.1.18 BQ.1.3 BQ.1.16 BQ.1.14 BQ.1.1.19 BQ.1.1.13 XBB.1.6 BQ.1.1.22 BQ.1.25.1 CM.8 BQ.1.1.15 BQ.1.1.7 BA.5.1.28 BW.1.1 CM.2 BQ.1.1.30 CB.1 BR.1 DJ.1.3 XBB.1.1 BN.1.3.1 BK.1 BR.3 BQ.1.1.27 BQ.1.23 BQ.1.8.2 DN.1 BQ.1.1.8 BQ.1.1.23 BM.2.1 BN.1.4 XBB.1.4 DC.1 BQ.1.1.31 CC.1 XBB.3.3 BQ.1.1.21 XBB.3.1 DE.2 DE.1 CL.1 BM.6 BE.8 BA.5.6 BA.5.1.9 BY.1.1 BN.1.3.4 BF.11.2 BN.1.2 CA.3.1 BQ.1.1.20 CK.1 BA.5.1.16 BA.2.75.8 CP.1.1 BQ.1.1.2 BF.1 BN.3 BA.5.1.26 DR.1 XBH DN.1.1 BE.1.4.2 CH.2 BQ.1.1.26 BN.1.7 CZ.1 XBB.2.1 XBB.5 BA.4.4 CK.2.1 BE.3 BA.5.1.18 BA.2.38.2 BQ.1.5 BA.4.1.3 BA.2.53 BN.1.3.3 BA.4.3 BU.3 XAZ BN.5 BQ.1.1.25 XBB.1.4.1 BF.16 BA.5.1.2 BA.4.1.7 DP.1 BA.5.1.15 BQ.1.1.24	0.25104367 0.07193380 0.03774215 0.03109980 0.02647266 0.02258870 0.02197574 0.02056848 0.02015080 0.01885537 0.01713931 0.01497840 0.01429729 0.01396650 0.01388890 0.01328697 0.01147881 0.01098455 0.01041840 0.01024350 0.00945925 0.00895870 0.00848691 0.00800000 0.00746269 0.00732166 0.00708749 0.00667338 0.00650195 0.00622010 0.00616647 0.00597438 0.00567189 0.00542943 0.00535664 0.00530346 0.00527147 0.00527134 0.00520470 0.00507886 0.00507614 0.00507462 0.00464071 0.00433374 0.00422585 0.00418994 0.00401606 0.00385746 0.00349864 0.00333776 0.00312094 0.00311589 0.00291356 0.00278235 0.00264717 0.00252446 0.00245771 0.00243697 0.00233679 0.00232305 0.00224918 0.00219934 0.00207566 0.00205161 0.00201072 0.00198208 0.00192179 0.00188822 0.00179926 0.00178719 0.00175259 0.00175189 0.00173735 0.00173332 0.00173007 0.00172049 0.00170746 0.00167696 0.00161683 0.00160671 0.00159123 0.00156704 0.00156551 0.00152598 0.00148547 0.00147969 0.00146870 0.00144216 0.00143785 0.00143010 0.00141635 0.00138910 0.00138480 0.00135444 0.00133601 0.00132795 0.00131078 0.00130597 0.00127734 0.00126716 0.00124224 0.00113443 0.00112740 0.00112423 0.00112373 0.00109561 0.00106261 0.00106033 0.00104928 0.00102557 0.00101010 0.00100006	12.057975846617595	98.89977594221315
1.04.23.ENCJAN04.R1__NA__NA__230107_WW__00X.tsv	[('BQ.1* [Omicron (BQ.1.X)]', 0.7419743603152046), ('BA.5* [Omicron (BA.5.X)]', 0.09664463470966361), ('Omicron', 0.0762908646707756), ('BA.2.75* [Omicron (BA.2.75.X)]', 0.021049205243196145), ('Other', 0.0013053078891105759)]	BQ.1.1 XBB.1.5 BE.1 BQ.1.1.3 BQ.1.10 BQ.1.1.2 BQ.1.3 BQ.1.12 BW.1 BA.2.1 BQ.1.16 BN.2.1 BQ.1.1.5 BQ.1.22 BQ.1.1.13 CC.1 BA.5.2.18 BQ.1.1.15 BA.2.10.4 BQ.1.17 BQ.1.1.4 BA.2.10.1 BA.5.2.48 BQ.1.18 BQ.1.23 BQ.1.1.1 BU.1 BQ.1.1.10 BA.5.5.1 BA.5.2.13 BA.5.2.20 BQ.1.15 BQ.1.1.27 BN.4 BQ.1.28 CR.2 BQ.1.1.32 XBB.1.1 BN.1.4 CZ.1 DR.1 BN.1.3.3 BA.5.1.9 CY.1 XBG BA.5.2.43 BQ.1.1.24 BQ.1.2 B.58 CA.6 BQ.1.1.21 BQ.1.25.1 BA.2.75.8 DE.2 BN.1.3.1 BQ.1.1.28 BA.5.2.33 BA.5.1.16 XG BM.6 BA.2.2 CV.1 DC.1 DJ.1.2	0.55297945 0.05110800 0.04587045 0.03375209 0.03055645 0.01923430 0.01312650 0.01268356 0.01158350 0.01080807 0.00979363 0.00971789 0.00906128 0.00865145 0.00809958 0.00751547 0.00726986 0.00600601 0.00445633 0.00403431 0.00387597 0.00346021 0.00336814 0.00305810 0.00294724 0.00282346 0.00272975 0.00271283 0.00255102 0.00240168 0.00233819 0.00229533 0.00226501 0.00213956 0.00212314 0.00205158 0.00194715 0.00184843 0.00177477 0.00174797 0.00170891 0.00164488 0.00157604 0.00151592 0.00147384 0.00145843 0.00143486 0.00134236 0.00130531 0.00128805 0.00128123 0.00127543 0.00121311 0.00119379 0.00116542 0.00115676 0.00112964 0.00108780 0.00107794 0.00107434 0.00103178 0.00103119 0.00102627 0.00100338	11.4846144703644	97.84636992943852
