	summarized	lineages	abundances	resid	coverage
5.12.23.PLMAY09.R1__NA__NA__230512_WW__00X.tsv	[('Omicron', 0.9429744795492909)]	XBB.1.5.49 XBB.1.5.15 XBB.1.5.20 XBB.1.16.6 XBB.2.3.3 XBB.1.5.28 EG.2 XBB.1.16 FL.10 XBB.1.5.24 EG.1 XBB.1.5.10 XBB.1.5.61 FU.2 XBB.1.13 XBB.1.5.66 XBB.1.38 XBB.1.5.43 XBB.1.9.4 XBB.2.5 XBB.1.5.9 XBB.1.5.16 XBB.1.30 XBB.1.5.59 EG.1.2 DV.6 FL.6 XBB.1.5.35 XBB.1.17 FG.3 GD.1 XBB.1.37.1 FD.2 XBB.1.5.36 EG.1.1 XBB.1.31 XBB.1.5.57 FD.3 XBB.1.11.1 XBB.1.5.38 XBB.1.5.23 XBB.1.5 XBB.1.9.2 XBB.1.5.19 XBB.1.5.34 XBB.1.5.31 XBB.1.36 XBB.2.3.8 FT.1 XBB.1.34 XBB.1.16.5 XBB.7 XBB.1.5.44 XBB.2.3.9 XBB.2.3.6 XBB.1.19 CH.1.1.24 XBB.1.24.1 FW.1 XBB.1.4.1 XBB.1.39 FY.4 XBB.1.27 XBB.1.5.45 XBB.1.5.26 XBB.1.5.27 XBB.1.5.6 XBB.1.5.47 XBB.1.5.46 XBB.1.5.60 XBB.1.5.18 XBB.1.5.39 XBB.2.3.7	0.15611700 0.08476870 0.07915598 0.06580440 0.05477547 0.05343309 0.04178250 0.03808903 0.03755110 0.03311660 0.02833881 0.02409640 0.02049080 0.01992619 0.01963297 0.01783852 0.01753900 0.01350210 0.01081420 0.00784518 0.00654450 0.00632641 0.00582482 0.00530341 0.00524610 0.00495996 0.00444364 0.00379176 0.00378538 0.00364299 0.00307958 0.00294985 0.00287009 0.00269360 0.00228778 0.00220264 0.00211972 0.00198965 0.00197464 0.00194592 0.00189657 0.00187584 0.00185767 0.00176975 0.00170010 0.00169514 0.00164363 0.00162878 0.00161943 0.00157084 0.00146824 0.00145688 0.00138313 0.00132696 0.00128866 0.00128866 0.00125191 0.00124224 0.00121033 0.00118125 0.00115607 0.00114451 0.00112994 0.00112454 0.00111966 0.00111957 0.00107962 0.00106716 0.00102809 0.00101585 0.00101523 0.00100952 0.00100823	9.740948414178025	97.50526703006388
5.10.23.PLMAY08.R1__NA__NA__230512_WW__00X.tsv	[('Omicron', 0.9649174635377409)]	XBB.1.5 XBB.1.5.59 XBB.1.5.20 XBB.1.9.2 XBB.1.5.32 FU.1 XBB.1.5.65 XBB.1.5.16 FG.2 FL.2 XBB.1.16.1 FE.1.1 XBB.1.5.49 XBB.1.5.1 XBB.1.5.4 EG.1 XBB.1.5.61 FL.6 XBB.1.22.2 XBB.1.27 FL.8 XBB.1.5.37 XBB.1.5.26 EK.2 XBB.1.5.31 XBB.1.5.51 XBB.1.16.6 XBB.1.24 XBB.1.5.19 GA.3 XBB.1.5.39 XBB.1.5.64 XBB.1.16.5 EG.1.2 XBB.1.5.34 XBB.1.5.62 XBB.1.5.8 FL.2.1 XBB.1.5.23 XBB.1.5.50 FL.3.3 XBB.1.5.35 FL.9 XBB.1.34 XBB.1.5.5 XBB.1.37.1 XBB.1.5.63 XBB.1.5.36 XBB.1.5.44	0.28643555 0.11687029 0.08611416 0.07995898 0.04855640 0.04347310 0.03831980 0.03282313 0.03282313 0.03010019 0.02167361 0.01776198 0.01766560 0.01572330 0.01241376 0.01143140 0.00543584 0.00543478 0.00502440 0.00418410 0.00390805 0.00312744 0.00273573 0.00251889 0.00246740 0.00219895 0.00210647 0.00206825 0.00201207 0.00191656 0.00190291 0.00182236 0.00179986 0.00167038 0.00162338 0.00157853 0.00156900 0.00154273 0.00154185 0.00149573 0.00144115 0.00142768 0.00139687 0.00137174 0.00114613 0.00110619 0.00109230 0.00108460 0.00102076	10.983435738197134	96.02381032003478
5.10.23.PLMAY07.R2__NA__NA__230512_WW__00X.tsv	[('Omicron', 0.9624665157790682)]	XBB.1.5.20 XBB.1.5.11 XBB.1.22 XBB.1.5.59 XBB.1.5.49 XBB.1.16.1 XBB.2.3.11 XBB.1.5.15 XBB.1.5.66 XBB.1.9 XBB.2.3.2 EG.2 XBB.1.9.1 XBB.1.5.42 FL.11 FY.4 XBB.1.5.26 XBB.1.5.64 XBB.2.3 EK.2.1 XBB.1.5.37 FL.8 EG.4 EL.1 FL.6 XBB.1.5.10 XBB.1.16.6 XBB.1.5.28 XBB.7 XBB.1.5.1 XBB.1.37.1 XBB.1.5.35 FE.1 FL.2.1 XBB.1.34 FL.3 FD.3 EG.1.2 FL.9 FL.3.2 XBB.1.5.61 FL.3.4 XBB.1.27 XBB.2.9 XBB.1.5.57 XBB.1.37 FT.1 FL.2 XBB.1.5.45 XBB.2.3.8 XBB.1.5.50 XBB.1.16.5 XBB.1.31 XBB.2.3.6 XBB.1.15 FU.1 GE.1 XBB.1.5.63 XBB.1.5.19 XBB.1.7 FL.12 FL.10 XBB.1.5.23 XBB.1.5.31 XBB.1.5.65	0.27125844 0.07036790 0.06238534 0.05353789 0.04554260 0.04541174 0.03816735 0.03439845 0.03306863 0.03205746 0.03195270 0.03039416 0.02032880 0.01739130 0.01587790 0.01485283 0.01305850 0.01090100 0.01058412 0.00675676 0.00591716 0.00531517 0.00529267 0.00515895 0.00501984 0.00466124 0.00411749 0.00403770 0.00382723 0.00382044 0.00305591 0.00275129 0.00270378 0.00262329 0.00225703 0.00219838 0.00200401 0.00195950 0.00195878 0.00183150 0.00182899 0.00182066 0.00173913 0.00171748 0.00171317 0.00168842 0.00157783 0.00156128 0.00149750 0.00145852 0.00143000 0.00135440 0.00123457 0.00118243 0.00118133 0.00115174 0.00109577 0.00108215 0.00108075 0.00106906 0.00106270 0.00104384 0.00103806 0.00102951 0.00102200	9.642580520609869	96.1910176236498
5.12.23.PLMAY10.R1__NA__NA__230512_WW__00X.tsv	[('Omicron', 0.9215136317931784), ('Other', 0.028168222418175147)]	XBB.1.5.20 XBB.1.5.59 XBB.1.16 XBB.1.5.49 XBB.1.5.28 XBB.1.5.15 EG.2 FE.1.1 XBB.1.5.21 XBB.1.5.23 XBB.1.22.1 FL.1 XCC XBB.1.22.2 XBB.1.16.6 FY.2 FD.4 XBB.1.30 XBB.1.18.1 FL.6 XBB.1 XBB.1.5.27 EK.2.1 XBB.1.5.39 FL.8 XBB.1.5.37 XBB.1.37.1 XBB.1.5.31 XBB.7 XBB.1.5.34 FD.3 BA.2.10.4 XBB.1.27 XBB.1.24 XBB.2.9 XBB.1.19 GA.3 XBB.2.3.8 FY.4 XBB.1.5.43 XBB.1.5.36 XBB.1.5.42 XBB.1.31 FG.3 XBB.1.5.61 XBB.1.5.35 FL.9 XBB.1.36 XBB.1.5.1 XBL.2 FD.2 XBB.1.5.11 XBB.1.5.24 BY.1.1.1 XBB.1.5.26 XBB.1.5.18 XBB.1.5.19	0.12337480 0.10266188 0.09854258 0.09164970 0.06196997 0.05782861 0.05311990 0.04937396 0.03329563 0.03027330 0.02862341 0.02716380 0.02702408 0.02358024 0.01926140 0.01755160 0.01454350 0.00656455 0.00527250 0.00521905 0.00502818 0.00438596 0.00416527 0.00345269 0.00330639 0.00297999 0.00278138 0.00275767 0.00254842 0.00250313 0.00240385 0.00210717 0.00202429 0.00178951 0.00177936 0.00166113 0.00157756 0.00151686 0.00150561 0.00149925 0.00147275 0.00146987 0.00146520 0.00143062 0.00139470 0.00138591 0.00127951 0.00123494 0.00121457 0.00114415 0.00112962 0.00111202 0.00108277 0.00106505 0.00105214 0.00104031 0.00103959	10.663688115749977	97.11734608567703
5.10.23.SBMAY07.R2__NA__NA__230512_WW__00X.tsv	[('Omicron', 0.978423448871626)]	XBB.1.16 XBB.1.16.1 FU.1 XBB.1.5 XBB.1.5.18 XBB.1.5.67 XBB.1.5.64 XBB.1.5.37 XBB.1.5.59 XBB.1.5.26 XBB.2.3.9 XBB.2.9 XBB.1.22.2 XBB.1.5.33 XBB.1.5.69 XBB.1.5.16 FG.2 XBB.3.1 XBB.1.16.5 XBB.2.3.1 XBB.1.5.63 XBB.1.5.51 XBB.1.5.57 XBB.1.5.68 XBB.1.5.38 XBB.1.5.31	0.28236202 0.12661996 0.12661996 0.10226624 0.10226624 0.10226624 0.10226624 0.00296736 0.00288184 0.00270270 0.00263158 0.00253807 0.00226074 0.00171600 0.00162602 0.00156250 0.00156250 0.00145879 0.00141287 0.00124224 0.00124018 0.00123115 0.00122775 0.00122200 0.00114679 0.00112549	10.660516659969414	83.62371668394475
5.11.23.ENCMAY05.R2__NA__NA__230512_WW__00X.tsv	[('Omicron', 0.9437849267547593), ('Other', 0.005183099948302193)]	BA.2.10 XBB.1.5.49 XBB.1.5.15 XBB.1.9.1 XBB.1.37 XBB.1.5.16 XBB.1.5.66 XBB.1.9 FL.7 FU.1 FW.1 FU.2 XBB.1.16.1 XBB.1.5.39 XBB.1.16.4 XBB.1.5.56 XBB.1.22.2 XBB.1.30 XBB.1.16.6 FL.6 XBB.1.18 FL.1 XBB.1.5.59 FL.8 XBB.1.5.17 XBB.1.5.35 BA.2.85 BA.2.9.5 XBB.1.25 XAU EK.3 XBB.1.5.2 XBB.3.1 BA.2.50 XQ XL XBB.2.3.2 BA.2.61 BA.2.10.4 BA.2.37 FL.9 FL.3.4 B.11 XBB.1.5.61 XBB.1.5.6 XBB.1.27 GA.3 XBB.1.24.3 XBB.1.5.11 BA.2.38.2 XBB.1.5.26 B.39 XBB.1.37.1 XBB.8.1 XBB.1.16.5 XBB.1.5.63 FD.1.1 BA.2.10.3 BA.2.3.7 XBB.1.7 BA.2.68 B.1.1.320 B.1.1.428 XBB.1.9.3 XBB.1.5.1 BA.2.57 BA.2.10.1 XBB.1.5.51	0.15124068 0.11661227 0.10757913 0.07205237 0.06429606 0.06155117 0.05756514 0.04701854 0.03354300 0.02864260 0.02535518 0.01960780 0.01564658 0.01477184 0.01298290 0.01147230 0.00637959 0.00586178 0.00544070 0.00527284 0.00427553 0.00386195 0.00377247 0.00374438 0.00285281 0.00266411 0.00256859 0.00250122 0.00249307 0.00221576 0.00220994 0.00210379 0.00189407 0.00189394 0.00182469 0.00178333 0.00176991 0.00172546 0.00172433 0.00171527 0.00167521 0.00165690 0.00164370 0.00163934 0.00151688 0.00147710 0.00147493 0.00145560 0.00143205 0.00142383 0.00140909 0.00137331 0.00136054 0.00133156 0.00129786 0.00121300 0.00120265 0.00118064 0.00115512 0.00115429 0.00113938 0.00111732 0.00104877 0.00104058 0.00102987 0.00101163 0.00101112 0.00100867	25.219908772294534	95.04397552085075
5.11.23.ENCMAY09.R2__NA__NA__230512_WW__00X.tsv	[('Other', 0.47337788480727866), ('Omicron', 0.4532737528913497)]	B.1.1.161 BA.2.10 XBB.1.9 BA.2.10.3 BA.2.57 XBB.1.13 BA.2.11 XBB.1.5.59 B.1.1.172 BA.2.10.2 BA.2.13 XBB.1.5.31 XBB.1.5.35 XBB.1.38 FE.1 B.1.1.371 XBB.1.5.11 XBB.1.5.18 M.3 BA.2.21 BA.2.10.4 XBB.1.5.55 B.1.1.339 XAJ EK.3 B.1.1.37 FG.3 B.1.1.487 FG.2 XBB.3.1 B.1.1.185 B.1.1.373 B.1.1.187 XBB.1.5.52 B.1.1.228 XBB.1.36 BA.2.61 B.1.3 FY.2 XBB.1.37 XBB.1.5.50 XBB.1.4.1 FL.11 XBB.1.18 XBB.1.5.63 B.39 B.1.1.175 XBB.1.17 BA.2.70 B.1.518	0.45027683 0.30076209 0.05351287 0.02236814 0.00973236 0.00915832 0.00490581 0.00489776 0.00303556 0.00290698 0.00267045 0.00242845 0.00239234 0.00225851 0.00223968 0.00222645 0.00211977 0.00208986 0.00194553 0.00193444 0.00182665 0.00182593 0.00181200 0.00179242 0.00179131 0.00179023 0.00177620 0.00169262 0.00166133 0.00161155 0.00155763 0.00153745 0.00151707 0.00147275 0.00144928 0.00138648 0.00138198 0.00133024 0.00124922 0.00119904 0.00119161 0.00119098 0.00116482 0.00112584 0.00109914 0.00108274 0.00107933 0.00107914 0.00106952 0.00104493	30.888088901566817	96.2077383540113
5.10.23.SBMAY02.R1__NA__NA__230512_WW__00X.tsv	[('Omicron', 0.9724634758500421)]	XBB.1.5.49 XBB.1.5.20 XBB.1.16 FY.2 XBB.1.16.2 XBB.1.5.1 XBB.1.5.26 XBB.1.16.6 XBB.1.5.61 XBB.1.5.9 XBB.1.5.15 XBB.1.5.39 XBB.1.34 XBB.1.5.57 XBB.1.5.50 XBB.1.5.5 FE.1 FD.3 XBB.1.5.42 XBB.1.5.35 XBB.1.5.10 XBB.1.5.17 EK.2 XBB.1.5.63 XBB.1.5.37 FU.1 XBB.1.5.31 XBB.1.5.11 XBB.1.5.60 XBB.1.5.64	0.35090900 0.27457876 0.14222511 0.07246690 0.03369040 0.02116950 0.01826890 0.00917832 0.00911889 0.00480769 0.00442183 0.00305981 0.00231036 0.00220868 0.00219299 0.00212089 0.00202879 0.00192976 0.00190476 0.00166517 0.00159864 0.00131670 0.00129622 0.00123020 0.00119760 0.00117197 0.00114811 0.00112176 0.00106594 0.00105982	9.94192780738842	96.83643781560379
