	summarized	lineages	abundances	resid	coverage
01.22.24.ENCJAN17.R2__NA__NA__240126_WW__00X.tsv	[('Omicron', 0.9240357805451263), ('Other', 0.006973073280148495)]	JN.1 JN.1.4 JN.1.1.1 HK.23.1 JG.3 JN.1.2 HK.20 JN.1.5 JN.1.12 XDP JD.1.1.5 JN.1.8 JD.1.2.2 BA.2.86.3 EG.2.4 XDG XDL JN.1.1.3 HK.3.12 JD.2 JJ.1 GJ.6 EG.5.1.9 XDK XBB.1.5.106 KJ.1 HV.1.2 FY.2.1	0.58654442 0.22125400 0.02798256 0.02249100 0.01690575 0.01297610 0.00502822 0.00475599 0.00311526 0.00296175 0.00289367 0.00264329 0.00215640 0.00200774 0.00163127 0.00145927 0.00144748 0.00130434 0.00129164 0.00125320 0.00123906 0.00116652 0.00111247 0.00110457 0.00108943 0.00107875 0.00106165 0.00105305	17.163981420269053	97.60559141223288
01.22.24.ENCJAN16.R2__NA__NA__240126_WW__00X.tsv	[('Omicron', 0.8623223203306659), ('Other', 0.07820252623823123)]	JN.1 JN.1.4 XDP BA.2.86.1 JN.1.7 EG.5.1.13 JN.1.1.2 EG.5.1.9 JN.1.2 JN.1.1.1 JN.1.5 HK.23 EG.5.1.4 HK.3.12 HK.11.1 EG.14 JD.1.1.6 JE.1.1.1 FY.2.1 JG.3 JG.3.3 EG.5.1.14 BA.2.86.3 KH.1 XDG HK.26.1 HK.3.9 BA.2.86.5 HK.29 XBB.1.34.1 XDK XBB.1.16.27 JN.2.1 EG.2.4 HU.1 JJ.1 JD.1.2.2	0.40568677 0.29660800 0.07571998 0.03297627 0.02267360 0.01649529 0.01370379 0.00951374 0.00863520 0.00818900 0.00583287 0.00556369 0.00301831 0.00289376 0.00272755 0.00256648 0.00207370 0.00180728 0.00165853 0.00154639 0.00154639 0.00150628 0.00143219 0.00139340 0.00133391 0.00127750 0.00121629 0.00120603 0.00118765 0.00115808 0.00114863 0.00110855 0.00106195 0.00102249 0.00102067 0.00101063 0.00100402	15.31538243667595	95.79975253319066
01.22.24.SBJAN16.R1__NA__NA__240126_WW__00X.tsv	[('Omicron', 0.9406574842268266), ('Other', 0.010351929642009107)]	JN.1 JN.1.4 JN.1.1.1 JN.1.3 JN.1.2 JF.1.1 BA.2.86.1 JF.1.1.2 XDK HK.3.1 JF.1 BA.2.86.4 JN.1.8.1 JN.1.5 JN.1.7 XBB.1.16.27 HK.13.1 XDM HK.3.12 HV.2 HK.33 KJ.1 HK.3.3 JN.5.1 JN.9 JN.2 FU.5 BA.2.86.3 JN.3.2.1	0.50356045 0.27714200 0.05673142 0.02448148 0.01229280 0.01227339 0.01040269 0.00974911 0.00874378 0.00388326 0.00362689 0.00313205 0.00275123 0.00223431 0.00221762 0.00191167 0.00165017 0.00160815 0.00155693 0.00136160 0.00125085 0.00116891 0.00111129 0.00107518 0.00105744 0.00101230 0.00101095 0.00100883 0.00100267	17.964259268201147	97.6992275022573
1.16.24.ENCJAN12.R2__NA__NA__240126_WW__00X.tsv	[('Omicron', 0.909350003020912), ('Other', 0.014070990778001712)]	JN.1.4 JN.1 HK.3.1 EG.5.1.6 EG.5 JN.1.2 JN.1.3 JN.1.1.1 HV.1.4 XCY XCP JD.1.1.6 JD.1.1.5 JN.1.8.1 JN.1.7 EG.5.2.3 FL.1.5.2 JN.1.1.3 EK.2.1 JD.1.1.1 HK.6 EG.5.1.9 JN.1.5 XDG EG.5.1.12 FL.11 KB.3 GE.1.2.1 XBB.1.16.27 XDK FL.4.4 XBB.1.27 FL.10.1 HV.1.7	0.36352100 0.32190537 0.08954404 0.02791212 0.02434773 0.01550790 0.00736275 0.00613466 0.00599700 0.00578856 0.00554263 0.00530666 0.00518345 0.00479478 0.00363788 0.00322904 0.00272694 0.00260078 0.00190245 0.00186775 0.00172117 0.00163933 0.00160643 0.00152915 0.00143472 0.00138028 0.00129299 0.00129085 0.00122877 0.00121065 0.00120769 0.00102599 0.00102290 0.00101660	20.360010106633673	98.06373942413805
1.16.24.SBJAN14.R2__NA__NA__240126_WW__00X.tsv	[('Omicron', 0.9323956929631285), ('Other', 0.0013752499572771558)]	JN.1 JN.1.4 JN.1.1.1 JN.1.2 EG.5.1.6 EG.5.1.4 BA.2.86.1 HK.11.1 BA.2.10.4 JG.3 FL.4.5 EG.5.2.4 JN.1.5 HV.1.7 BA.2.86.3 EG.5.1.8 FL.1.5 XDG EG.5.1.12 HV.2 JN.1.1.3 XL FL.13.4	0.54006621 0.18003200 0.08080934 0.03896700 0.02924299 0.02160843 0.01460828 0.00324379 0.00278196 0.00272529 0.00262621 0.00215885 0.00166541 0.00166308 0.00148303 0.00145745 0.00142158 0.00137525 0.00136687 0.00122058 0.00110926 0.00107759 0.00106047	17.702256276796806	98.66234157107982
1.16.24.PLJAN09.R2__NA__NA__240126_WW__00X.tsv	[('Omicron', 0.9128800100127148), ('Other', 0.02103773242212991)]	JN.1 JN.1.4 JN.1.2 JN.1.10 JN.1.1.1 JN.1.9 XDP EG.5.1.4 JG.1 EG.5.1.6 JN.1.7 JG.3 HV.1.1 JN.1.6 JN.2.1 JJ.1 JN.1.12 EG.5.1.9 HN.3.1 HK.3.2.2 HK.3.9 FL.19.1 JN.1.5 JN.1.8.1 EG.5.2.3 XDL BA.2.86.4 KK.1 HK.3.3 HK.3.12 XDG HV.2 XDK HK.22 XCT.1 HV.1.7 EG.5.2.2 JN.3.2.1 JR.1 JD.1.2.2 BA.2.86.5 HK.3.2.1 HV.1.9 XCN XCR JD.1.1.3 JG.3.1 XBB.1.16.27	0.34798535 0.33186500 0.03995570 0.03561508 0.02385845 0.01665380 0.01177078 0.01058997 0.00954562 0.00858992 0.00807152 0.00713770 0.00616747 0.00599845 0.00447269 0.00433418 0.00409277 0.00373832 0.00361838 0.00351617 0.00272940 0.00257412 0.00255520 0.00241692 0.00237961 0.00219516 0.00202303 0.00197658 0.00187559 0.00180832 0.00173852 0.00169834 0.00160500 0.00147524 0.00144011 0.00143963 0.00135931 0.00133411 0.00124783 0.00123709 0.00121904 0.00120930 0.00117096 0.00114416 0.00114400 0.00111542 0.00111532 0.00111307	17.571666086200203	98.4349396381634
01.22.24.PLJAN14.R1__NA__NA__240126_WW__00X.tsv	[('Omicron', 0.956490470979402)]	JN.1 JN.1.4 JN.1.1.3 HV.1.2 JN.1.2 JN.1.9 JN.1.1 JN.1.7 JN.1.8 KH.1 JN.1.3 JN.1.12 JN.1.5 EG.5.1.14 JN.3.2.1 HK.3.3 HK.23.1 HK.20 HK.11.1 HK.3.12 EG.5.2.3 KC.1 EG.2.4 HK.6 JN.2.3 EG.5.1.12 XBB.1.34.1 HV.1.7 JN.3.1 JN.3.2 JJ.1 KJ.1 BA.2.86.3 HK.13.1 JG.3.1 JB.1.1 XBB.1.16.27	0.47752846 0.33467700 0.01461830 0.01288420 0.01164210 0.01134937 0.00962150 0.00961025 0.00862079 0.00831947 0.00775696 0.00649351 0.00497694 0.00317783 0.00270964 0.00239578 0.00214362 0.00201519 0.00184704 0.00183463 0.00168780 0.00167910 0.00166528 0.00148100 0.00143909 0.00143636 0.00132100 0.00130651 0.00128020 0.00119300 0.00118439 0.00117756 0.00115260 0.00114902 0.00106326 0.00104144 0.00101028	14.570951273502274	96.64247734341036
1.16.24.ENCJAN08.R2__NA__NA__240126_WW__00X.tsv	[('Omicron', 0.9486395269197581), ('Other', 0.0035121915377169946)]	JN.1 KL.1 JN.1.4 HV.1.6 JN.1.11 JN.1.1.3 BA.2.86 JN.1.5 JN.1.7 JN.1.2 BA.2.86.4 JN.1.1.2 JD.1.1.6 JN.1.8.1 BA.2.86.3 JD.1.1.5 XDG JN.1.9 BA.2.86.5 KH.1 GW.1.1 EG.12 JB.1.1 HV.2 XCG XCT GJ.5.1	0.57884580 0.15873278 0.08423040 0.02758338 0.02745754 0.01792099 0.01590051 0.00451553 0.00433960 0.00398238 0.00380508 0.00380294 0.00222585 0.00221637 0.00184260 0.00181965 0.00138049 0.00136054 0.00124883 0.00124198 0.00123267 0.00115607 0.00108136 0.00108131 0.00107766 0.00105404 0.00101536	16.676396923145653	97.26783265893054
01.22.24.SBJAN18.R1__NA__NA__240126_WW__00X.tsv	[('Omicron', 0.9108235394228699), ('Other', 0.04505136287906333)]	JN.1 JN.1.4 XDK EG.5.1.6 JN.1.1 JN.1.2 KH.1 EG.5.1.10 JN.1.5 HK.6 GJ.6 BA.2.86.3 EG.5.1.12 HK.13.1 XBB.1.16.27 EG.5.1.9 GJ.1.2.5 HV.1.2 EG.2.4 XDG HV.1.5 HV.1.7 EG.11 HV.1.9	0.41990056 0.37818600 0.04392735 0.03499017 0.02514626 0.01445230 0.01385176 0.00440857 0.00214481 0.00186099 0.00169749 0.00150971 0.00150731 0.00123259 0.00117371 0.00117285 0.00116993 0.00113911 0.00112906 0.00112401 0.00107701 0.00104428 0.00102771 0.00100137	18.034976532276556	98.69243888573052
01.22.24.PLJAN15.R2__NA__NA__240126_WW__00X.tsv	[('Omicron', 0.9425236915255019), ('Other', 0.004359795476826885)]	JN.1 JN.1.4 JN.1.1.1 JN.1.2 JN.1.5 JJ.1 JN.8 JN.1.9 JN.5 JN.1.1.3 EG.5.2.3 JN.1.7 XDK JN.1.11.1 JG.1 XDG BA.2.86.3 BA.2.86.5 EG.5.1.10 JN.3.2.1 JN.3.1 XBB.8.2 JN.5.1 EG.11 EG.9.1 JN.9 XBB.1.16.27 GN.1.4	0.44807063 0.19681200 0.15846522 0.05111610 0.01629400 0.01323533 0.01143980 0.00932039 0.00750166 0.00442478 0.00398866 0.00251166 0.00249706 0.00235417 0.00229046 0.00186274 0.00164609 0.00141044 0.00135672 0.00130840 0.00127584 0.00117574 0.00114958 0.00113127 0.00108527 0.00106762 0.00105237 0.00103950	16.24927803428607	97.08724877102632
1.16.24.PLJAN07.R2__NA__NA__240126_WW__00X.tsv	[('Omicron', 0.9150443683925501), ('Other', 0.037231838852425425), ('A', 0.0010316399994205574)]	JN.1 JN.1.4 BA.2.86.1 JG.3 JN.1.1.1 XDK EG.5 JN.1.10 JN.1.7 XCP FL.1.5.2 JN.1.8.1 JN.1.5 EG.5.2.3 JN.1.12 HK.15 FL.15.1.1 GN.3 BA.2.86.5 HK.26.1 JN.1.11.1 BA.2.86.3 XDG BF.7.17 JQ.1 JN.7 HK.3.12 EG.2.4 GW.1.1 DE.2 BW.1.1.2 EK.2.1 EG.5.1.12 GK.1.10 XDL BA.2.2.1 B.35 HK.3.4 JJ.1 A.27	0.47194980 0.22525600 0.03962552 0.02659735 0.02440415 0.02139790 0.01376671 0.01259776 0.01212860 0.01178376 0.01097732 0.01019110 0.00946473 0.00878559 0.00787402 0.00473934 0.00471421 0.00388601 0.00264550 0.00247158 0.00232829 0.00197068 0.00182761 0.00177112 0.00171030 0.00169587 0.00152362 0.00135410 0.00134273 0.00131686 0.00122699 0.00118343 0.00118064 0.00113552 0.00113324 0.00109989 0.00108932 0.00107306 0.00105597 0.00103164	18.249919301251158	87.0614988462696
1.16.24.PLJAN10.R2__NA__NA__240126_WW__00X.tsv	[('Omicron', 0.9446266376108948), ('Other', 0.0010465599943227783)]	JN.1.4 JN.1.10 JN.1.9 JN.1.2 EG.5.2.3 JN.1.11.1 JN.1.1.1 JG.3 JN.1.5 EG.5.1.12 JJ.1 JG.3.4 JN.1.1.3 HK.3.6 JD.1.2.2 HK.22 JN.1.3 JG.1 XBB.1.16.27 XDG KL.1.1	0.80097500 0.08788627 0.01320664 0.00633717 0.00479104 0.00473934 0.00377576 0.00323924 0.00294271 0.00241175 0.00213121 0.00185736 0.00182351 0.00164784 0.00125463 0.00119760 0.00119187 0.00115274 0.00106480 0.00104656 0.00100013	18.87387192275765	99.35457980804601
01.22.24.PLJAN17.R1__NA__NA__240126_WW__00X.tsv	[('Omicron', 0.9475953561559818), ('Other', 0.007499979356570801)]	JN.1 JN.1.4 BA.2.86.1 JG.3 JN.1.2 JN.1.8.1 JN.1.7 JG.3.4 JN.1.1.1 JN.1.5 JN.1.9 JN.1.1.2 HV.2 XCZ JN.1.12 JN.1.6 JN.5 HK.23.1 EG.5.2.3 JG.1 JN.1.1.3 HK.22 HK.3.4 BA.2.86.3 EG.5.1.12 HV.1.7 HV.1.9 BA.2.86.5 JN.9 XCT.1 JN.1.3 HK.26.1 XDG HK.3.12	0.34655691 0.30723000 0.05386428 0.03542591 0.03382870 0.03136411 0.02409240 0.02085145 0.01913302 0.01307980 0.01128581 0.00946703 0.00670490 0.00535252 0.00479386 0.00476167 0.00318108 0.00310625 0.00233250 0.00219035 0.00142045 0.00140056 0.00138912 0.00124037 0.00117806 0.00117233 0.00116632 0.00116029 0.00112762 0.00111939 0.00103525 0.00103146 0.00102807 0.00102350	18.187117708041065	98.75932180717653
1.16.24.PLJAN08.R2__NA__NA__240126_WW__00X.tsv	[('Omicron', 0.8774469450362349), ('Other', 0.05652392581824181)]	JN.1.4 JN.1 EG.5.1.6 XDK JG.3.4 EG.5.1.4 JN.1.6 JN.1.2 JN.1.1 JN.1.11.1 XDP JN.1.9 FL.1.5.2 JJ.1 JN.1.1.2 XDA.1 KK.2 JN.1.3 HN.5 EG.2.4 BA.2.86.4 XBB.1.16.27 JN.1.12 EG.5.1.9 JC.5.1 HK.13.1 BA.2.86.3 FL.24.1 JN.1.5 XDG JD.1.1.6 HV.1.7 KH.1 HV.2 JC.1 JR.1 HV.1.6 KC.1 BA.2.86 EG.5.1.12 XE XBB.1.9.6 HK.34.1 KL.1.1 HK.26.1	0.34446400 0.29883970 0.07646924 0.04286192 0.01906083 0.01461459 0.01098389 0.01049091 0.01001477 0.00775316 0.00657430 0.00645793 0.00627413 0.00587761 0.00563623 0.00501691 0.00448430 0.00359229 0.00347152 0.00332594 0.00322863 0.00288374 0.00284091 0.00267666 0.00257397 0.00248944 0.00248798 0.00239591 0.00237186 0.00207079 0.00185131 0.00183641 0.00183150 0.00176471 0.00162942 0.00152181 0.00150055 0.00147336 0.00132858 0.00131666 0.00117825 0.00117085 0.00110988 0.00109416 0.00107936	17.167851929415562	96.82640537738689
1.16.24.SBJAN11.R2__NA__NA__240126_WW__00X.tsv	[('Omicron', 0.9262936779950025), ('Other', 0.03274486257383075)]	JN.1 JN.1.4 JN.1.1.1 XDP EG.5.1.4 JN.1.3 HV.1.1 HN.2 XDK JN.2 JN.1.5 EG.7 JN.1.2 HK.8.1 XCT HV.1.2 JG.3 HK.11.1 JN.3.2.1 GE.1.2.1 XDG HK.13.1 EG.5.1.9 XCV HV.2 HK.3.12 EG.5.1.10 HK.26.1 EG.5.1.5 JN.9 EG.5.1.12 XBB.1.9.6 JN.1.1.3 XBB.1.16.27 EG.1.8	0.57246398 0.16244000 0.10677245 0.02343171 0.01845683 0.01183637 0.00801894 0.00556961 0.00375355 0.00368006 0.00332033 0.00289675 0.00288819 0.00282270 0.00257796 0.00207900 0.00206929 0.00183234 0.00174569 0.00174368 0.00162525 0.00162338 0.00156912 0.00135639 0.00128014 0.00127097 0.00124381 0.00121197 0.00116077 0.00112936 0.00105079 0.00104891 0.00103413 0.00102712 0.00100700	16.032507874157307	97.10062535531551
01.22.24.PLJAN16.R1__NA__NA__240126_WW__00X.tsv	[('Omicron', 0.9187867468653254), ('Other', 0.00546743101335137)]	JN.1.4 JN.1 HK.26 EG.5.1.6 JN.1.1.1 JN.1.7 JG.3 JN.1.3 EG.5.1.4 JN.1.2 JG.3.1 JN.1.8.1 JN.1.1.2 XBB.1.9.2 JN.4 JD.1.1.5 EG.5.1.3 EG.5.1.9 JD.1.1.6 HK.3.2.2 KB.3 BA.2.86.3 EG.5.1.16 HK.3.13 KB.2 JN.1.5 XDG JD.1.2.2 EG.4.2 JN.1.1 EG.2.4 XBB.1.5.50 JD.1.1.4 HV.2 HK.3.12 EG.14 HK.26.1 XCV EG.5.1.12 XDC JN.3.1 HV.1.2 HV.1.9 FL.4.6 HK.3.14 XCG FY.2.1	0.31143700 0.28806600 0.12776334 0.05108005 0.01453815 0.01070140 0.01047187 0.00928112 0.00886360 0.00688278 0.00612392 0.00558741 0.00546845 0.00497974 0.00462837 0.00352505 0.00326500 0.00320513 0.00282640 0.00252525 0.00249377 0.00237740 0.00237182 0.00208551 0.00206649 0.00206588 0.00200573 0.00199725 0.00198735 0.00187840 0.00184948 0.00168719 0.00157295 0.00153846 0.00150048 0.00130053 0.00128866 0.00126030 0.00120966 0.00119435 0.00112719 0.00106157 0.00106107 0.00102987 0.00100925 0.00100705 0.00100649	19.275043277557366	97.60893555830519
